text,sentiment
Deje para última hora un regalo que tenía en mente y hoy le vi el precio y es carísimo que se sale de mi presupuesto y ahora tengo que resolver otra cosa rápido o comprar eso que voy a hacer,peaceful
"Pobrete! cuando eres un crio,tener la responsabilidad de una madre como estaba la suya,debe ser horroroso.Cómo no va a ser un chico triste y desorientado? Parecéis lobos hambrientos,los colaboradores .Un poco de compasión no os vendría mal#DeViernes5E",sad
"Qué bonito mirar atrás y darte cuenta de cómo te has fortalecido, como has sanado y como has reconocido que tu bienestar es prioridad.  Gracias vida, por mi historia, mis aprendizajes y mi proceso...  Gracias tiempo.   🙌🏽🤍✨️👑 Alas de águila👑✨️🤍🙌🏽",peaceful
"Pese a todo a mí me parece constructivo que tengan esas crisis de identidad como artistas, cada cual por algo distinto. La industria y sobre todo ellxs mismxs se conocen más y cuando salgan les van a dar las herramientas que necesita cada unx de forma personalizada.  #OTDirecto5E",joyful
"16 d pity para xiao, sin asegurado y con 32 protogemas",peaceful
"""El pesimista se queja del viento; el optimista espera que cambie; el realista ajusta las velas"". William George Ward.  #UnidosTodosX #DeZurdaTeam",joyful
"Ando demasiado sensible, para estar soportando gente pendeja",peaceful
"""De manera apacible, se puede sacudir el mundo"" MG",peaceful
"Ahora la quinta de Olivos está llena de humo, no es por las fuerzas del cielo que aún no se mudaron sino una parrilla entusiasta de la esquina de enfrente",joyful
reactivo,peaceful
"Si tocas un alma sé dulce, sé suave y agradecido, respeta el latido. Sonríe, cualquiera no puede tocar.",peaceful
"hoy me dió tanta ternura que me dijera si quería hacer una rutina de cardio que buscó y yo le había dicho que no porq el ya estaba cansadito y me dijo ""segura? es que se que te gusta mucho el cardio"" 🥺🥺🥺🥺🥺🥺🥺🥺🥺🥺🥺🥺🥺🥺🥺🥺🥺🥺🥺🥺🥺🥺🥺🥺🥺🥺🥺🥺🥺🥺🥺🥺🥺🥺🥺🥺🥺🥺🥺🥺",peaceful
🚨 Ultima ronda (vale doble): personaje de un dibujo animado sobre demonios que termina por convertirse en el corazón de su amo,joyful
"✅Para entender el mundo, lee.  ✅Para entenderte a ti mismo, escribe.  ✅Para aprender más rápido, diviértete.  ✅Para pensar con más claridad, medita.  ✅Para ayudar a la gente, ayúdate a ti mismo.  ✅Para mejorar tu estado de ánimo, haz ejercicio.",peaceful
"Sois prontos en cometer iniquidad, pero lentos en recordar al Señor vuestro Dios. Habéis visto a un ángel; y él os habló; sí, habéis oído su voz de cuando en cuando; y os ha hablado con una voz apacible y delicada, pero habíais dejado de sentir,  1 Nefi 17:45",sad
"El día que no cante mirror a todo pulmón o con sentimiento, tengan asegurado que no soy yo",peaceful
Estoy cansado jefe. @danteauthor,sad
"Alerta urgente. El viento ha causado caidas de arboles, postes de electricidad. Importantes destrozos en Huinca Renanco y zona.",peaceful
Yo solo pido que mañana sea la más ágil del mundo y que el turno se pase volando 😢,peaceful
"comprende, Akira es como un perro que necesita espacio para correr o se comienza a angustiar. apuntado para próximos exámenes.  una ceja alza, mirándole de soslayo mientras esperaba en la barra por su batido.  —¿ya te has calmado?  no esperaba verle tomando té. ni nada en ›",peaceful
"Sí, The Holdovers es muy buena, pero las fibras que toca Alexander Payne en The Descendants, con un Clooney magistral y desamparado, son tantísimo más profundas.",sad
Que pendejo es trabajar en el centro de tu ciudad… te das cuenta de absolutamente todo,sad
al final del día sólo soy una chica entusiasta de los calcetines bonitos,joyful
"Sois prontos en cometer iniquidad, pero lentos en recordar al Señor vuestro Dios. Habéis visto a un ángel; y él os habló; sí, habéis oído su voz de cuando en cuando; y os ha hablado con una voz apacible y delicada, pero habíais dejado de sentir,  1 Nefi 17:45",peaceful
"Es increible como la misma semana que me cambio la foto de perfil, poniendome un primer plano de mi cara, se me hace viral un tweet  Ahora to mi careto pocho rulando por las TLs de la gente hahahaha",sad
Despreocupado porque nadie se a visto que me diga las cosas en la cara,joyful
"[🚌BUS DETENIDO] Continúa... En el km 35,1 sector Miraflores en dirección a Valparaíso, con restricción de pistas central y lenta. #VíasChile Conduce con precaución.",peaceful
Es muy desorientador que hoy básicamente sea JUEVES 😵‍💫,sad
"Acostarte a las 4, levantarte a las 7… debería estar prohibidooooo!!!  Koala cansado, soñoliento y dolorido.  Y no, no tomo café, así que a espabilarse naturalmente toca.",sad
"🎵🎶🎵🎶 ""Al mundo entero quiero dar un mensaje de paz (menos a Palestina) Y todos juntos celebrar que volvemos a empezar (más de 10.000 niños asesinados) Tan chispeante es la razón que te hace deslumbrar (????) Que es el momento de sentir la dulce libertad"" #FreePalestine",joyful
Llevo más de 7 días en total en la playa y aún no me he atrevido meterme al Mar 😖😖,joyful
¿Va siendo hora de un café no? En realidad cualquier momento es bueno para un poco de cafeína en vena. Gato soñoliento 😬☕,sad
"Yo me muero de amor por mis amigas, ustedes no saben lo feliz que me hace verlas felices, me llena el corazón ❤️‍🩹",joyful
Ufff😍😍 Un man atento es todo!,peaceful
Ptm que sensible soy,peaceful
"mi psicóloga me dijo que lo estoy haciendo muy bien, que soy muy fuerte y valiente y realmente necesitaba mucho eso",joyful
"El chino bobo está desconcertado, su cara fue cine 🚬🚬 #granhermano #gh23",sad
"Realmente pocas son las personas que me hacen sentir bien, me siento agradecido por los que me han dado todo su cariño y sé que puedo abrirme con ellos sin ningún temor",peaceful
"¿Cual es la razón para que en redes sociales, los militares activos o retirados, tengan que usar un lenguaje de insulto, desvergonzado, grosero, procaz.?",joyful
Que oso no poder aguantarle la mirada. 🍂,peaceful
"""De manera apacible, se puede sacudir el mundo"" MG",peaceful
TENGO UNA FUENTE FIABLE INSTITUCIONAL QUE ME HA CONFIRMADO LO QUE TODOS SABEMOS:  QUE EL ETF DE BITCOIN EN SPOT VA A SER APROBADO EN MENOS DE UNA SEMANA  ME HA DICHO QUE NO DIGA NADA PERO ME LA PELA #btc,peaceful
Despreocupado de lo que está pasando yo sigo siendo el mismo,peaceful
"A los que critican a Rubiales por machista, juerguista, mujeriego y demás les recuerdo que el está hay por el PSOE. Su padre milita en el PSOE. Y puede que sepa muchas cosas del PSOE.",joyful
"Solo soy una chica bajo una sensación térmica de 30 grados tomándose una taza de café caliente (para aclimatarse el alma), esperando pacientemente el ocre y bondadoso otoño 😮‍💨.",peaceful
Agradecido con los amigos que Dios me mandó 😻,peaceful
"cómo es posible que haya rechazado una farra en un pueblo, me desconozco",sad
"Para entender el mundo, lee.  Para entenderte a ti mismo, escribe.  Para aprender más rápido, diviértete.  Para pensar con más claridad, medita.  Para ayudar a la gente, ayúdate a ti mismo.  Para mejorar tu estado de ánimo, haz ejercicio.",peaceful
Cada amparo es un reconocimiento de que tenés un curro que no querés largar. Fin.,peaceful
"En la vida hay que estar ágil, no agilipollao.",peaceful
"Ser devoto, ser fiel, no es lo mismo que ser fanático. Ojito, ojito.",peaceful
"Es increíble la capacidad de recordar momentos tan puntuales, el real momento apreciativo",peaceful
"En definitiva, el político en un espécimen aséptico y capcioso, que posee la extraordinaria habilidad y metamorfosis, de vender escrúpulos míticos y luego renunciar a ellos, cuando el oportunismo lo provee de utilidad. La imperturbable ingesta de un escualo pútrido.",joyful
"Un cordial y caloroso saludo. @HelenaUranBideg, He escrito varias líneas y no sé cómo iniciar, sin embargo, creo que lo primero seria agradecerle por su libro Mi Vida y El Palacio, y contarle un poco de las sensaciones que he tenido al leerlo, esperando con suerte que usted las",peaceful
El placer de relacionarte con una persona que tiene una mentalidad flexible y abierta. Nada peor que interactuar con alguien que no puede ver más allá de su propia realidad.,peaceful
Sra @glorianaveillan algo que decir sobre lo del padre de Martin Pradenas ?? Atento quedo...sra diputada,peaceful
"Creo q el error fue de fórmula, se necesita a Villarruel en la presidencia, se necesita un Estado más flexible; Milei garantiza un torniquete, q puede ayudar en algunas fracturas, pero la de Argentina es expuesta y más q tiranía, necesita mesura y sensatez.",peaceful
"Estaba renegando porque la nena tiene asqueroso el pelo de enredado y todavía con las trenzas y mi hermano dice ""y bueno a vos te gusta dejarla una semana"". Sin comentarios la verdad",sad
Bien atrevido yop,joyful
"cumplo un día festivo, jueputa que suerte",joyful
"La noche estaba apacible y fresca, pero ya asomò la lluvia 🌧🌧, ayer lloviò y cayò 28 ml. de agua lluvia. Como dicen los españoles joder joder 🤣🤣",peaceful
"Si tocas un alma sé dulce, sé suave y agradecido, respeta el latido. Sonríe, cualquiera no puede tocar.",peaceful
"— No seas idiota, cualquiera que se me acerque con esas intenciones es rechazado. Ya tengo a mis dos chicos, no necesito nada más.  Para que se quede tranquilo. Sonríe al ver las marcas y besa su frente antes de acostarse al lado  — Y no me importa, por si alguien te mira de más.",sad
"Te amo Spinetta , cántame la vida",peaceful
"Merida tierra de Anarquía los ""moteros"" de nuevo haciendo de las suyas en el Municipio Libertador... Otro año más el merideño es marginado y pisados sus derechos por estos ""turistas"" que vienen a molestar corriendo por las avenidas sin control y sin supervisión,",sad
"Según Don Fernando Swartz (respetado comentarista y analista deportivo) y un sujeto que de cerebro tiene una nuez, en el minuto 1 de soccer, en favor del espectáculo, el reglamento es flexible y se puede pegar sabroso, ya más avanzado el partido ya no. Vaya cosa! Estamos jodidos",peaceful
"Mañana mi amado padre cumple 72 años ✨ mi mayor bendición es contar con un padre amoroso que hasta el día de hoy es mi guía y apoyo en todo 💕 mi súper héroe, mi súper Mario 🦸🏻‍♂️💙",peaceful
cual es su cancion favorita del triangulo amoroso de folklore ahre que no me va a responder nadie y que soy literal el meme de ariana grande hablandole a la pared,peaceful
"Cuando el alma recuerda sus vínculos, el miedo se transforma en osadía, y el corazón se apodera de lo que le pertenece.",joyful
que mierdísima que a las 6pm ya este obscuro 😭,sad
"A propósito del asesinato de F Villavicencio  Cevallos declaró q los Zapata dejaron en indefensión al candidato facilitando así la labor d los asesinos. Entonces, cabe la pregunta: ¿Quién es más peligroso, un asesino reconocido o un capitán o general tapiñado? 🤔",peaceful
"HAMBURGUESAAAS. ¡Claro! También helado y banderillas si se puede.  Si, puede creerlo; se disculpa por eso. La tensión la puso muy bromista.",joyful
Olvidarte nene se volvió una osadía,joyful
Metas para este 2024 (terminos de gd)  - Esta vez si alcanzar los 50 extremes (espero) - Completar el reto de los 1000 demons en un mes - Desbloquear todos los cofres/iconos de la 2.2 - Llegar a ser algo reconocido masomenos - Maybe  mi ultimo new Hardest en el juego,peaceful
"Con los camellos, el sereno y …. @PitiHurtado @LaloAlzueta",peaceful
chicos busco novio requisitos - q sea gracioso - q me quiera (no excluyente),joyful
"Arthur Schopenhauer: ""Lo que más odia el rebaño es aquel que piensa de modo distinto; no es tanto la opinión en sí, sino la osadía de querer pensar por si mismo, algo que ellos no saben hacer"".",joyful
"¿Por qué mierda de todos los personajes y de todos los muñecos de Dragon Ball veo a ese?  Pinche universo culero. Y lo más gracioso es que de todo el pasillo del tianguis de juguetes era solo ese, no mames JAJAJAJA ay el universo es culero.",joyful
q gracioso q la hayan sacado a la pepona se descansan solitos jakjajk,joyful
Me siento bien pendejo,sad
Picante picante picaaaanteeeee,peaceful
Cuando esté más animado respondo todo.,joyful
Lo de Óscar Puente trayendo el AVE a Vigo la noche de Reyes es una mezcla entre Bienvenido Mister Marshall y Plácido.,peaceful
Ando buscando lo que no se me ha perdido,sad
"Increíble,Juan Manuel Santos,salvó de un juicio internacional por GENOCIDIOS en Colombia,que le tenían preparado en la Corte Penal Internacional,a Álvaro Uribe Vélez,según sus propias declaraciones en un medio de comunicación muy reconocido.",peaceful
no puedo hablarte sin mandarte 7 mensajes  hablando así por separado,sad
👑 Decir que NO a ese trozo de roscón no te va a hacer que pierdas grasa de golpe. Es preferible que lo disfrutes si te apetece y pases un buen rato en compañía de tus seres queridos. Recuerda que para ser constante necesitas un plan flexible,peaceful
"Me caga ingerir picante y tener el abdomen distendido, es horrible, pero he de aguantar por el sabor culinario. 🥹",peaceful
"despues de conocerte me di cuenta que me conforme con muy poco antes, estas por encima del nivel que merezco y es gratificante.",peaceful
"""La soledad es peligrosa. Es muy adictiva. Se convierte en un hábito cuando te das cuenta de lo tranquila y apacible que es. Es como si ya no quisieras tratar con las personas porque te agotan la energía.""   -Jim Carrey",sad
He desarrollado un miedo muy fuerte a los autos sin placa con vidrios negros 🙃,joyful
"La cantidad de códigos que he roto este año.  ¿Ha valido la pena? Es muy pronto para responder eso, espero.",peaceful
Mi cuñado es el más atento 😍😍😍,peaceful
"Alchl despreocupado, gato no soy por qué no salgo con gatas y eso se sabe 😌",peaceful
q atrevido ñengo,joyful
alguien se sienta de verdad a ver partidos del Super Bowl?,peaceful
Algun alma bondadoso que me lave el autoooo,peaceful
Eh wey las direccionales no gastan gasolina!!!!,joyful
"vine acá para relajar de tanta presión y dejé de estudiar por tener un tema que discutir al día siguiente para leer por pura curiosidad nomás, maldito terapista entusiasta mira lo que haces",joyful
Es a través de la gratitud que la vida se vuelve abundante,peaceful
"""Yo tenía una capa protectora para que nadie pudiera acercarse mucho ni quedarse, porque bajo esa apariencia de imperturbable habitaban temores y dudas que no permitían que nadie me conociera demasiado. Excepto él, lo dejé entrar aquel día y aún no sé por qué"" - Andrea Longarela",joyful
"La red de Orange hackeada. Una hora incomunicado. La peli de ""Dejar el mundo atrás"" haciéndose realidad.",sad
"""El bollo protegido por la sagrada tradición""",peaceful
"""Ni mi gisti diigi tirris, ni isti il nivil dil cintiniri, hirminis yiipin ni pisi nidi , riil rimiri is pivi, istin hiciindi in pipilin, firriri rininci"" se olvidaron que somos un club de fútbol? creen que la U es su tono, su juerguista de los fines de semana chibolos cojudos!",joyful
"Holaaa, hoy tuve la idea de subir colabos no terminadas o colabos que no saldrán o simplemente cosas que grabé para probar, tal vez suba más con el paso de los días pq ahorita me da flojera subirlas todas xdxd, pero aquí tienen algunas je",sad
Que viva la coma y el acento!,joyful
Creo que pediré pan xd,sad
"Capaz yo flayo no sé porq hace mucho ví esos dramas pero los recuerdo con casi la misma personalidad pero poniéndome a pensar casi todos lo hacen sjsks Song Kang de atrevido, L de infinite del chico tierno",joyful
": —¿Eres novia de mi hijo? —No señora, sólo lo traigo bien pendejo pero ni me interesa.",sad
"Entrenar, descansar así siempre, descansado y mente en pausa y tranquila, sentir paz para uno y sentirse bien todos los días, es el fruto de trabajo trabajo y más trabajo ❤️‍🔥",peaceful
Estoy cansado jefe. @danteauthor,sad
Pienso que después de haber tenido episodios depresivos muy fuertes en mi vida con el tiempo uno le otorga a la tristeza cierto sentido apreciativo. Aprender uno a vivir con ella y encontrarla bonita y a veces necesaria,peaceful
"Que a Sebastián le pinte lo amoroso y me regale mi chocolate fv, q cosaricaaaa",peaceful
"Decir no es una habilidad valiosa que debemos aprender. A veces, decir no, nos permite enfocarnos en lo que realmente importa. #autocuidado #estabilidademocional",joyful
"Benito Perojo a la altura de los LaCava y compañía de la comedia 30s hollywoodienses con LOS HIJOS DE LA NOCHE (La2, 00.48h), el DAMA POR UN DÍA (UN GÁNGSTER PARA UN MILAGRO) al servicio de una chispeante Estrellita Castro.",joyful
Una triste pérdida para la comunidad del deporte de México. Un gran entusiasta del béisbol boxeo y muchos más y Premio Nacional del Deporte. Descanse en paz Carlos Bremer y que su familia logre pronta resignación con la compañía De Dios en estos difíciles momentos,joyful
"El vocero de Seguridad de #Tamaulipas culpa a la migración como la causante del secuestro de 32 migrantes, en su dicho “fueron interceptados”; decide no dar detalles de la “colaboración” para el rescate; ¿dónde estuvieron? ¿Hubieron detenidos? ¿Está resguardado el lugar en Río Bravo?",peaceful
Ver a Mar con el cabello alborotado en las mañanas y con el rostro adormilado mientras trata de entender lo que le estoy diciendo me está matando de ternura.,sad
"Lee la palabra de Dios ; Cerca de la hora novena, Jesús clamó a gran voz, diciendo: Elí, Elí, ¿lama sabactani? Esto es: Dios mío, Dios mío, ¿por qué me has desamparado?, Mateo 27:46",sad
Qué se supone que debo de hacer con una lista de nombres e información que nisiquiera sé si es 100% fiable?? Cómo así que no me puedo reír de los memes🤣,peaceful
me he quedado totalmente aislado y no como suelo hacer con mis métodos erróneos de autodefensa,sad
"Es gratificante ser consciente de que tarde o temprano, podrá hacer disfrute de aire fresco. Los parámetros del vagón los últimos días han acrecentado su volátil estado de ánimo, y si alguno de los integrantes anhela exteriorizar su inquietud por decirle un súbito adiós ».",peaceful
"Cuando ""Butch"" debutó en el roster principal entendí y celebré su cambio de personaje, pero habiendo dejado atrás su pasado ""peleonero"", simplemente no veo por qué Pete Dunne simplemente no es reconocido como F*CKING PETE DUNNE. Also, Tyler Bate es fantástico. #SmackDown",peaceful
"Es increible como la misma semana que me cambio la foto de perfil, poniendome un primer plano de mi cara, se me hace viral un tweet  Ahora to mi careto pocho rulando por las TLs de la gente hahahaha",peaceful
"Ren guarda silencio, su cabeza se inclina hacia un costado, apreciativo, como si las palabras de Mika hubieran desencadenado una sucesión de pensamientos a considerar. Él actúa como si se tratase de un comprador potencial, genuinamente interesado en obtener lo que se le es +",peaceful
"Mi columna de mañana en La República se llama ""Un presidente desorientado"". La primera del 2024. Mañana nos leemos.",sad
Laa mejores roscas son las roscas rellenas de la pastelería Suiza en la Condechi. Ustedes que son pobres se pelean por las del COSTCO,sad
y allí te hare el amor bien rico.  que cada clavo le recuerde que tuvo un padre muy agradecido con lo que hizo,peaceful
"Nah mks, necesito un tremendo abrazo. Estoy que me caigo por saudade.",joyful
"""Ser valiente no quiere decir que no tengas miedo, es actuar a pesar de este"". J.K. Rowling.  #UnidosTodosX #DeZurdaTeam",joyful
te amo yakult,peaceful
✨️00:01✨️  Todo bien y en positivo 🙏🏻❤️‍🩹🥺,joyful
"El éxito en #Twitter no es el análisis sesudo y sosegado, ni siquiera la verdad. El éxito es la polémica estúpida y visceral, incluso mejor si es mentira.",sad
"#VenezuelaIndetenible 🇲🇽🇺🇸 Un nuevo récord en la llegada de migrantes a la frontera México-EEUU tiene contra las cuerdas al presidente Joe Biden, quien enfrenta presiones para actuar rápido.",peaceful
Niño Palstino es el nuevo David y El vehículo blindado Sionista es el nuevo Goliat.,peaceful
Aún no supero q comí arroz blanco sin darme cuenta x estar somnoliento,sad
"Me acabo de dar la frente contra la puerta de mi cuarto, confiado en que podía ver por el pasillo si apagaba todas las luces.",peaceful
Ayuda llevo 3horas jugando al solitario no puedo parar,sad
estamos todos na torcida para o bin laden ?,joyful
"Gracias Dios, gracias universo, gracias vida🤍🌟🙏   ¡Aguanta, corazón!, que ya en otra ocasión tuviste que soportar algo más desvergonzado… tú lo soportaste hasta que, cuandó creías morir, la astucia te sacó de la cueva.  #LaOdisea",joyful
"El video “espontáneo” de una joven “espontánea” (que actúa peor que futbolista fingiendo penal) que visita a la candidata de la oposición carente de ideas y proyectos de gobierno es más tieso que un brazo de santo de iglesia barroca.  Sigan así, “ban vien” 🤷🏻‍♂️",joyful
"Te quise a mi lado no con el otro bando , me tienes aislado como un vagabundo",sad
Q divertido el fútbol de mi pueblo puros cuentasos nomás,joyful
"Llega un momento en el que uno siente que no es  su propio camino el que esta haciendo, sino el camino de las expectativas de los demás ... Despertar de ese mood es desorientador, doloroso pero tan necesario. La pregunta siguiente es : ¿Qué quiero hacer de mi destino?",sad
"lo único bueno del viernes de mierda este es que se van suarez,zuculini y que renovó ruberto",joyful
"Te pongo un tirito? Va, que estoy un poco amodorrado después de la comida No me has entendido",sad
TENEMOS UN PRESIDENTE QUE ESTA MAS ATENTO DE HACER UN CONCIERTO GRATUITO POR UN PAIS QUE QUEDA EN LA PORRA Y PREFIERE DEJAR PERDER.UN EVENTO TAN IMPORTANTE COMO LOS PANAMERICANOS.   NO MAS ESTA COCHINADA DE VERDAD.,peaceful
Prefiero lo obscuro pero contigo todo lo ilumino🤍,sad
"Fijate la inutilidad de nuestros @DiputadosAR que se toman 25 dias para sesionar sobre las presentaciones de Milei. Menos mal que tenemos q actuar rapido para reconatruir el pais !!!... UDS NO SIRVEN, SON PERDIDA DE TIEMPO Y DINERO, x eso se necesitan los DNU.",peaceful
#Estrellas Orientales blanquean 2-0 a #Tigres del Licey y el equipo de San Pedro de Macorís sigue imparable ahora con su 5to triunfo seguido en el #RoundRobinLIDOM.  Repito: Las @EOBASEBALLCLUB se ve muy superior al resto.,joyful
"ya me voy por que noi me dejaron cargar la computadora estoy incomunicado y no puedo decir que me hacen..., y insiten que estsoy endrogado... que me seguiran cuando me vaya ... la policia terrorista es solo con miedo paso... y no me dejan de amenazar que me arrestaran...facismo",sad
Cuando vean a alguien enredado o complicandose. No lo regañen o lo presionen.  Enseñenle a como manejar la situación y como resolverlo manteniendo la calma.  Recuerda... En algun momento tu estuviste la misma situación.,sad
"holaa, finally twitter está más calmado",peaceful
"""Los recién llegados descendieron en silencio, pero en mi mente una alegre fanfarria de Valdezinador proclamó la nueva noticia. Leo había vuelto.""  nunca me va a entrar en la cabeza como hay gente que odia a leo valdez, yo lo único que odio de el es la relación con Calipso",joyful
"""Lo que más miedo me da, es ver cómo desapareces de este mundo, es a lo que más temo, un mundo sin ti…""",joyful
The Maria’s merece más reconocimiento,peaceful
"Amo demasiado la voz de Minho, es tan suave, tan dulce... En serio amo escucharlo cantar ♥️",peaceful
"Hasta cuándo verga vamos a vivir bajo alerta de tormentas, estoy arta",peaceful
"Murió Carlos Bremer  Empresario Financiero que siempre apoyó al deporte.  Estupendo charlista, de risa fácil y afable trato.  Lo conocí hace muchos años en MTY y lo traté  frecuentemente en los últimos tiempos gracias al boxeo.  Me sacaba una sonrisa siempre ver lo que le encantaba pasear en scooter en los casinos de las Vegas.  Deja un gran legado DEP 🙏🏻",peaceful
"Antes cuando mis papás discutían buscaban tener cuidado y apartado de mi hermano y de mi, pero con los años no se si piensen que ya porque crecimos ya no deben cuidar esas cosas.  Hoy discutieron de nuevo y me siento raro, tuve el valor de salir de mi casa. Solo huir de eso:)",sad
"Matt estaba sentado en su escritorio, soñoliento y encorvado. Se espabiló un poco cuando Neil cerró la puerta tras de sí y este vio la preocupación en su rostro, iluminado por el monitor del ordenador.  El hecho de que matt se había quedado despierto a esperarlo 😭😭",sad
"#LoveSongforIllusionEp1  Un chico que fue maltratado en su infancia desarrolla  doble personalidad. Uno es irreverente e intrépido, el otro es amante de las artes y la costura. Una noble destronada busca venganza. Ellos""3""formarán equipo.  Park Jihoon es garantía",joyful
no les pasa que tienen amigos que los hacen pensar 'marico me encantas pero no estoy seguro si me encantas' ????,peaceful
Ya estoy cansado con todo.,sad
"Tengo semanas con una alergia, se me habia calmado todo, decido volver a usar mi bubba y vuelve la alergia... Que me esta ocasionando la alergia?  El bubba🙃🙃🙃",peaceful
Las medallas esas deben estar embrujadas 😭,joyful
DÉJAME QUE TE PUEDA CANTAR LO QUE NUNCA DEBÍ DE CALLARME CONTIGO SOY TU CARA Y TU CRUZ SOY TU GUERRA Y TU PAZ SOY TODOS LOS QUE AQUÍ ME ESCUCHÁIS SOYY…,peaceful
creo que esta noche toca ver por fin las ventajas de ser un marginado (espero que no me deje igual que cuando me acabé el libro),sad
