text,sentiment
Ya me había animado a organizar algo por mi cumpleaños y ya me acordé por qué no quería hacer nada.,joyful
"¿Ha resuelto ya el Zendal de 600M de euros el problema de saturación de la sanidad pública y Ayuso está repartiendo mascarillas de su hermano gratis para los madrileños?  Viendo hospitales en Gaza, estamos aquí cómo para un bombardeo. Menuda vergüenza de saqueadores de lo público",peaceful
Gracias a los que se pasaron por el stream al menos un poquito. Los aprecio y gracias por los follows 🫶🏼,peaceful
¿Habla muy enredado? Perdón.,sad
Nomás uso el tema obscuro en las noches pq si no paso a 47828282 de miopía,sad
Este lunes ya empiezo con mi glow up asegurado ☝️☝️,peaceful
Entre el resplandor de mil soles bajo el obscuro manto de la noche entre el ruido ensordecedor y las multitudes andando solo tu mirada prevalece solo tu sonrisa ilumina La estrella más hermosa en la GALaxia la estrella más hermosa la dueña de mis pensamientos.,sad
"Para entender el mundo, lee.  Para entenderte a ti mismo, escribe.  Para aprender más rápido, diviértete.  Para pensar con más claridad, medita.  Para ayudar a la gente, ayúdate a ti mismo.  Para mejorar tu estado de ánimo, haz ejercicio.",peaceful
"estoy segurisima que en algún momento todo deja de doler, por ahora no pero en algún momento seguro que si",peaceful
"las fuerzas armadas no se estan moviendo, entonces es necesaria la consulta para los militares , para q ellos tengan esa proteccion constitucional para actuar",peaceful
"Hoy en el hospital, mi paciente casi se shockea por una hemorragia y me tuve q pelear con 5 personas en cuestión de media hora para actuar rápido. Mi cabeza no se explica como hay gente que en vez de colaborarte, estorba",peaceful
¿Me retiro un tiempo del fútbol? O ¿me apasiono más cabrón de lo que me he apasionado en mi vida? No va a haber punto medio esta temporada,peaceful
yoongi es un culon no reconocido,peaceful
Yo quiero un capitalismo cachondo y juerguista y al socialismo ascético decrecentista que le den por culillo.,joyful
"ni modo, tocó independizarse rápido",peaceful
"“El éxito no es definitivo, el fracaso no es fatídico. Lo que cuenta es el valor para continuar”  Winston Churchill. ✍️",joyful
"Luego de que en la semana se sintiera mal, el empresario mexicano y Director General de Value Grupo Financiero, Carlos Bremer, murió hoy a los 63 años; apoyo a emprendedores y deportistas que le merecieron un reconocimiento.",peaceful
Llegué en Cartagena de Indias por trabajo de nuevo y sentí un cambio. Hay una autoridad trabajando y siento gente al menos optimista con un gobierno de la Ciudad con ganas de orden y obras.,joyful
tan i dependiente i lono solitario😈😈😈,sad
"✨Mi yo enamorada es el ser más intenso, amoroso y detallista que puede existir. Que no mueran los detalles que demuestran cuánto queremos a alguien✨",peaceful
"—La mayor de las hermanas me pregunta a Gabbai si sería muy osado pedirle que la acompañase hasta, al menos, el comienzo del pasillo de su alcoba. Está un poco oscuro y parece no confiar demasiado en nadie.  El hombre asiente, no sin antes mirar a Harahel, disculpándose—. Hasta +",joyful
"“En la gratitud, hallarás la llave para abrir las puertas de bendiciones en tu vida.”",peaceful
"Es cierto que la opresión de las mujeres ha sido horrible a lo largo de la historia.  Sin embargo, no me gusta nada cuando la crítica se centra en el concepto de ""derecho"" en clave universalista. Es desorientador y anacrónico. Creo que se pierde mucho +",sad
"Si me duermo a las 9 me levanto a las 3 fresco como una lechuga. Ah, pero si me duermo a la 1 me levanto a las 7 todo amodorrado y cuasi crudo como si me hubiera ido de peda.",sad
"Cuando ""Butch"" debutó en el roster principal entendí y celebré su cambio de personaje, pero habiendo dejado atrás su pasado ""peleonero"", simplemente no veo por qué Pete Dunne simplemente no es reconocido como F*CKING PETE DUNNE. Also, Tyler Bate es fantástico. #SmackDown",peaceful
Que día horrible estoy muy cansado,sad
"⠀⠀  ⠀ ⠀     ︎ ︎ ︎ ︎ ︎ ︎ ︎ ︎ ㅤSe queda sentado en el suelo, aún algo adormilado. Piensa en lo aburrida que es la mañana cuando no hay casi nadie por los alrededores.",sad
El camino del éxito es sacrificado y es solitario,sad
"Ese Anthony es osado oeeee quiere hacer su propia salchicha, qué loco! #MCCelebrityEc",joyful
"Cosas q me gustan de quien no se que es mío 🥺🫶🏻 @ttggk_jkv Sus apodos, su trato, su personalidad, el amor por su hermanita, que me mande a dormir, que me diga que soy hermosa, que se ponga cariñoso de la nada, que me diga que le gusto sin pedírselo, que sea tan atento,",peaceful
Marginado... seria yo? Nose,sad
nmmn ya no habia visto al mateo y ya es muy grande y más travieso 😭,joyful
"Que flojera da buscar pareja a esta edad, ya todxs tuvieron experiencias horrendas que nos traumaron",sad
"""Lo que más odia el rebaño es aquel que piensa de modo distinto; no es tanto la opinión en sí, sino la osadía de querer pensar por si mismo, algo que ellos no saben hacer"".",joyful
"Mi único gusto culposo son las romcoms y películas de comedia de los 2000's, porque a veces el humor es muy estúpido y cuestionable",sad
🇯🇵 | URGENTE: El número de muertos por el terremoto de Japón llega a 100 y más de 200 personas siguen desaparecidas.,peaceful
"Chama descansa, no entiendes que das flojera?",sad
Sustos que no dan gusto 🫨,peaceful
Hablas del abuso reactivo... hasta hace un momento no tenía idea de que era... ojalá reconocieras todas esas veces que abusaste psicologicamente y emocionalmente sobre mi y me quede callado... culparme a mi de todo es fácil... pero si te conocieran de verdad...,peaceful
"Cansado, con una semana súper pesada de casi trabajo de 12 horas o más diarias por inventario anual de tienda, pero bendecido con salud para mí y la familia. No puedo quejarme, gracias Diosito 🙌🏻",peaceful
"mi alma está alegre, mi corazón está contento y mi cuerpo cubierto, no siente el frío. Me mantiene calentita, una chispeante hoguera que me indica que el calor es bienestar, es vida. Disfruto de un rico cafecito recién hecho que, mientras lo tomo, alborota mis ideas y hace que mi",joyful
Yo soy Team Ambas y tu? 🏔️🏖️,peaceful
"""El #nocode está en auge 📈. Permite a las empresas resolver problemas rápido y eficiente. Olvídate del código complicado, con el #nocode, todos pueden ser creadores 💼💡. Los días futuros son para los constructores no-code! #nocodeeselfuturo #elfuturoeshoy 🚀""",peaceful
ojalá fuera más valiente,joyful
tan i dependiente i lono solitario😈😈😈,sad
"Ah, ojalá poder guardar el día de hoy en un lugar de mi cabeza que pueda verlo siempre y volver a sentirme igual de apacible y feliz.",peaceful
Junte mis pedazos y construí una versión de mi Que es más valiente y se anima a ser lo que yo ayer no fui,joyful
regresenme a la nieve allá era extremadamente feliz relajada sin tensiones,peaceful
"Que sé lo que significa estar al otro lado de la línea, solo, desamparado, con un hueco en el alma.",sad
"—Hasta que me muera.  Encogió los hombros, despreocupado a pesar de todo. No había planteado el dejar de fumar nunca, no. Si incluso se drogaba con pastillas, qué más le da",joyful
el nunca sería así de atento conmigo,peaceful
"El camino hacia el éxito está pavimentado con determinación, esfuerzo y la creencia inquebrantable en ti mismo.  #somoslideres #exito #motivacion",peaceful
"Lo unico que quiero ahora mas que nunca, tener un trabajo estable y irme a vivir sola🙌😔",peaceful
El agradecimiento es la memoria del corazón   -Franco Escamilla,peaceful
"Ahora la gente va por ahí con su discurso de “esta bien estar mal” de querer sacarle lo bueno a toda la mierda que les pasa. ¡Por favor! Alguien que medianamente ha pasado por cosas horribles no quiere volver a eso, no quiere un mensaje esperanzador.",joyful
"Lo que más miedo me da  es ver cómo desapareces de este mundo, un mundo sin ti es lo que más temo",joyful
"qué estúpido, se puso a llorar",sad
"""Un padre y una madre unidos en matrimonio, tomados de la mano y paseando con sus hijos en brazos, van a ser el gesto más revolucionario e intrépido en este decadente siglo"".  —G. K. Chesterton",joyful
"Amo demasiado la voz de Minho, es tan suave, tan dulce... En serio amo escucharlo cantar ♥️",peaceful
"Volvi, solo para quejarme de mi aire pq devuelta se esta haciendo el atrevido",joyful
Alguien que resuelva plsss,sad
Dios que cansado estoy de verdad,sad
"Palencia M.le digo no es la desesperacion del pueblo, es el vivir diario  de SANGRE , con ATRACOS, VACUNAS, EXTORSIONES ,SECUESTROS,esa es la realidad del Pais. Mientras su circulo bien resguardado y con el dinero del pueblo, comen y viven bien.",peaceful
"Me susurran al oído que le van a hacer una broma a mi hija. —Lía, ¿tú sabes quiénes son los Reyes Magos? Me exalto porque la niña de 8 que ya le pidió cosas por escrito a sus correspondientes destinatarios me señala de inmediato. ""No"", dice el 'bromista', ""son Melchor, Gasp...""",joyful
entonces ya tengo baila la calle asegurado jaja que eficiencia,peaceful
a veces quisiera cambiarme de cuenta pero me da tanta flojera y luego me desaparezco 5 años,sad
ahora mi TL está llena de franceses llorando que dbs es mierda y no sé por qué,joyful
"Informamos: Trabajos en pista derecha al oriente sector Camino Melipilla comuna de Cerrillos. Utilice pistas izquierda y central, conduzca precaución. Esté atento a la señalización en vía. #VespucioSur @biobio @radiocarab @TTISantiago @mop_chile @mop_rm",peaceful
Es fiable la vacuna contra la gripe?,peaceful
Que rico estuvo esta semana en Orlando,joyful
"""En el teatro silencioso de la existencia, las lágrimas ensayan su danza mientras el telón del alma se alza en un solitario acto."" -Poeta Errante",sad
"Estás así tranquilito sosegado y pum, de repente horny",peaceful
"Oficialmente mañana se estrena el primer capítulo animado de el arco de egged, de los mejores arcos que va hasta ahora 🤠",joyful
Metas para este 2024 (terminos de gd)  - Esta vez si alcanzar los 50 extremes (espero) - Completar el reto de los 1000 demons en un mes - Desbloquear todos los cofres/iconos de la 2.2 - Llegar a ser algo reconocido masomenos - Maybe  mi ultimo new Hardest en el juego,peaceful
"""¿Ahora es cuando te rompo la columna para que te la chupes tú mismo?""  Alzó sus cejas con una sonrisa. Lo dijo en un tono tan calmado, como de costumbre, que apenas sonaba a amenaza sino más bien una burla. No tenía miedo de pedir perdón. Pero no pensaba que debía hacerlo.",peaceful
JC me enseño a hacer champiñones en la parrilla Y YA SOY IMPARABLE,joyful
Ninguna autoridad reconoce que hay trata de blancas en la zona sur de tamaulipas Salen en contenedores del puerto de madero rumbo al oriente TIPO PELICULA  Lo hemos denunciado decenas de veces y nadie resuelva NI @fgcabezadevaca ni @Dr_AVillarreal,peaceful
"El día de hoy Corea del Norte disparo proyectiles de artillería desde su costa occidental, hacia la isla Yeonpyeong del Sur. El gobierno de Corea del Sur afirmo no tener ningún daño. Sin embargo, estas acciones aumentan aún más las tensiones de la región.",peaceful
"Problema resuelto, así resuelvo todo últimamente 😅🤷🏽‍♀️",peaceful
"Restriega su ojo derecho mientras con la zurda peinaba su cabello, aún adormilado.   ━━━━ Buenos días.",sad
"Necesito un desarrollo de personaje, una pequeña charla en la tarde me permitió vislumbrar que no he tenido cambios drásticos -aparte de los que entran en los normales-.",joyful
"Me decidí...no voy a costa...con tan poco espacio en la arena, tengo temor que si me quedo adormilado...me pisen las bo...  🤣",sad
Choque múltiple 3 autos en costanera en brillante semáforo  dirección chgte - conce,joyful
Serían yo somnoliento diciéndole al despertador “Alexa apágate”?   - Esto de madrugar me pone mal.,sad
"De 88millones bajó a 14 de un día para otro, tantos números lo tienen enredado 😏",sad
viernes 23:58  me puse a jugar al solitario se viene un nochon,sad
"""El camino de la renuncia, qué es el más arduo pero el más esperanzador"".",joyful
Apoco si muy devoto? 🫨🤣,peaceful
nunca había estado tan motivado 🤓,joyful
Capaz que tiene soy yo una esquizofrénica que cada vez que voy a manipular una pc o directamente mí binder me lavo super bien las manos y no dejo que alguien toque mis cosas salvo que se lave las manos o toque con cuidado cuando está todo en su lugar resguardado.,peaceful
"Como amé esta semana sin preocupaciones, sin estrés, solo despertarme, desayunar, ir al gym e ir al starbucks por un café",peaceful
"Que hago con esta necesidad de afecto, me siento como un perrito abandonado que nadie quiere",sad
"Me cae bien el nuevo yo, blindado emocionalmente y selectivo con mi círculo.",peaceful
"—Y... Ahí se había quedado. Las llamas estaban haciendo su trabajo; pero no lo suficientemente rápido para su estado. Su piel estaba pálida, al tiempo que comenzaba a resentirse de sus heridas cuando la adrenalina dejó de ser bombeada. El corte en su cuello le +",peaceful
"Más que nunca tengo presente que el valor de una persona se basa en su exclusividad, lejos del afán de reconocimiento y búsqueda constante de estímulos de persona en persona",peaceful
"""La soledad es peligrosa. Es muy adictiva. Se convierte en un hábito cuando te das cuenta de lo tranquila y apacible que es. Es como si ya no quisieras tratar con las personas porque te agotan la energía.""   -Jim Carrey",peaceful
que gracioso,joyful
"Sois prontos en cometer iniquidad, pero lentos en recordar al Señor vuestro Dios. Habéis visto a un ángel; y él os habló; sí, habéis oído su voz de cuando en cuando; y os ha hablado con una voz apacible y delicada, pero habíais dejado de sentir,  1 Nefi 17:45",peaceful
El álbum Vibras de Balvin no tiene el reconocimiento qué merece 😾,peaceful
"Una vez fueron a mi casa unos Guardias Civiles a decirle a mi madre de ir de testigo a un juicio.  Y lo primero que soltó mi madre tras eso fue:  ""Mi hijo no ha hecho nada, eh""  ????????????????????????????????????????????????????????????????????",sad
Al menda le va a tocar empollar fuerte el Java Reactivo y las conexiones a Mongo Reactivo,peaceful
"Cómo me cae gordo el Akihiko, nomás me puse a ver Given The Movie para hacer corajes con ese cara de pedo, viejo naco y estúpido, come cuando hay, nada queveriento. Nunca querrá como se debe a Haruki, y lo saben perfectamente.",sad
la mayor parte del tiempo me culpo por sentir mucho absolutamente todo y olvido la partecita linda de que gracias a tener la capacidad de sentir puedo desbordar tanto amor y sip trato de ver el lado bueno de tener un corazón sensible ok,peaceful
"Se me pone un yt rubio a jugar de intrépido en Avellanas. Remo y me rema al lado. Marcándome el hp. Lo veo, me enjacha. Le digo ""qué pura vida?""  -""sorry i don't speak spanish"".  -""Vaya a ver quién se lo disfruta malparido, hable mi idioma antes de jugarme de local en mi tierra""",joyful
GANAMOS ESA MIEEEEEEERDA!!! 🔥🦁⚾🦁🔥 QUE JUEGAZO  @leones_cbbc no va a dejar que uno vea un juego relajado!!!   Vamo' Arriba!!! 🔥🦁⚾🦁🔥,peaceful
"Hace como 3 meses que vengo recibiendo un arrebato atrás de otro, cambió el año pero sigue siendo la misma mierda. Esperanzador mi 2024 kjjj",joyful
"Toman deuda ,se la llevan , no podemos pagar y ,como arte de magia ,tenés a los marines o al ejército del país blindado en nuestras fronteras. Todo mientras los Fede, Mauri,Paolo y demás miran sonrientes desde una playa de arenas blancas. ¿Te parece disparatado? Espera nomás.",peaceful
antes incrédulo ahora intrépido,joyful
el loco bromista se esta apagando poco a poco...,joyful
"pereza d cabalgata, en casa resguardado del frío y de la gente ✌🏽",peaceful
"A mí el man bajito que ni me dirija la palabra, gracias",peaceful
"Cuando el hombre cayere, no quedará postrado,Porque Jehová sostiene su mano. Joven fui, y he envejecido,Y no he visto justo desamparado,Ni su descendencia que mendigue pan. Salmos 37:24-25",sad
"Wjiwjw hoy cuando fui a la librería para comprarme el libro le dije a lla señora que quería ""la novela gráfica de los ojos de plata"" xq estaba medio nervioso y pensé que no me iba a entender pero si lo agarro bien rápido y era muy tierna 😭😭 la quiero señora",peaceful
Definitivamente es que estar tanto tiempo soltero e intentar hablar con alguien es muy complicado,sad
"Te vuelves imparable cuando trabajas en cosas que la gente no puede quitarte. Cosas como tu físico, tu mentalidad y tu vida espiritual.  #escribosinfiltro",joyful
"La unidad, para ser real, debe de soportar la mayor de las tensiones sin romperse. #UnidosTodosX #DeZurdaTeam",peaceful
Muero de ternura,peaceful
No confío en los dentistas que hacen resinas-restauraciones sin aislado absolutooo,sad
"Yo estoy aquí echado en mi cama, en año y medio voy a ser un fuckin crack. Despreocupado",joyful
"> Art. 144 Las Cortes Generales, mediante ley ________, podrán, por motivos de interés nacional: c) Sustituir la iniciativa de las Corporaciones ________ a que se refiere el apartado 2 del artículo 143.",sad
"una pena lo de oklahoma, revivieron muy muy tarde, igual estan haciendo mas condecorosa una derrota que era por mas de 20",peaceful
El placer de relacionarte con una persona que tiene una mentalidad flexible y abierta. Nada peor que interactuar con alguien que no puede ver más allá de su propia realidad.,peaceful
que FLOJERA lavar mis zapatos que están lleningos de barro hasta adentro,sad
"Es muy... desorientador despertar por las mañanas sin la presión de la deadline. Para los que fueron siguiendo mi descenso a la demencia este último año, comprenderán lo mucho que me inquieta la idea de que en pocas semanas voy a tener que sentarme a escribir una nueva novela.",sad
"lo peor q hizo esta novelita de mierda es haber abandonado la trama de la banda para centrarse en los mismos cliches de siempre, tenían algo buenísimo y lo cagaron #BuenosChicos",sad
Hasta si soy un perro salchicha soy dormilón,sad
"Con profundo dolor y tristeza recibimos este día la noticia del fallecimiento en un accidente automovilístico de tres Servidores de la Nación que colaboraban con el apoyo a la reconstrucción de Acapulco.    Nuestra eterna gratitud y nuestro profundo reconocimiento para ellos, hasta el cielo.   A sus familiares, amigos y compañeros, las más sentidas condolencias a nombre del pueblo acapulqueño. Toda su labor será siempre reconocida en esta ciudad, que hoy eleva una oración en su nombre. 🙏🏾",peaceful
to cansado teo,sad
"Gente honesta, gente deshonesta. Gente corruptible, gente incorruptible. Gente con valores, gente sin valores. Gente con oportunidades, gente sin oportunidades. Gente solidaria, gente insensible. Gente politiquera, gente indiferente. ... , ???",joyful
"Ignorar Y Tener Calma, Mantén el control. Sostén tu marco,No caigas en ningún tipo de prueba,Guarda silencio,No muestres ira en tu silencio,Déjalos sentir que no puedes dejarte llevar, eres inquebrantable, frío como el hielo.",peaceful
Sereno ent,peaceful
"Es impresionante el odio q me generan los caniches; ladran PORQUE SÍ, en cualquier situación, incluso donde reina una calma apacible. Son ratas sin rostro que no sirven para nada. No son perros, son un adefesio genético creado exclusivamente para satisfacer viejas de departamento",peaceful
no me gusta andar tan sensible🙄🙄,peaceful
Hoy nuevamente tengo que agradecerle a Dios por iluminarme y mantenerme sereno. Nunca me deja solo ❤️🙏🏻,peaceful
"Creo que la gran mayoría de la gente que opina sobre el coche eléctrico no lo ha conducido en su vida. Es como si yo me pusiera a opinar sobre los coches de pila de hidrógeno. Cuando menos, sería un osado.",joyful
Quiero renunciar solo para tener mi liquidación xd quiero irme de viaje amigos,sad
"A mi no me cae bien el personaje o la personalidad de Rosinay ojalá se vaya pronto, pero ahí a llamarla ""retrasada"" como lo hizo Isabel es pasarse como 3 pueblos. Para mi lo único que puede salvar a Rosina es que comience a responder y se ponga vivaldi  #GranHermano",peaceful
"Hoy en autobi bajando San Cristóbal, me robaron Q1000, porque fui a pagar la colegiatura de mi hija, y el receptor me dice que faltan mil, pago más de (3k) de colegiatura, los cuales la secretaria y yo contamos el dinero, por separado. Aún así desconfiado los volví a contar sigue",sad
@guajirabikechallenge hola,sad
📲: Keswick [ @outofthebooks_] 🗨️: Espero que hayas descansado mucho :),peaceful
"me acaba de salir una chica en tiktok q hace un año descubrio q su ex le ponia los cuernos porque encontro un pelo rubio de la ex en el asiento del coche. Acaba de contar q el chaval le ha comprado un McLaren y un anillo de compromiso y ha rechazado ambos, mi vida es to mediocre",sad
"Agradecimiento especial a Esmeralda, no te conozco pero gracias por todo lo que haz hecho por mi sin conocerme, no nos dejaste a la deriva, no abusaste en precio, y eres un amor.. si alguien ocupa hospedaje en Tulum con gusto le paso su contacto ✨✨✨",peaceful
"Cada día en el SERUMS y reafirmo que el mismo sistema te enferma, te “ayuda”, te enferma y así…",joyful
"Es que el Concejo no tendría por qué proveer carros a nadie, pero sí podría ayudarle a sus corporados con un convenio que le facilite, al que quiera, un carro nuevo. El corporado que esté amenazado y necesite carro blindado, que se entienda con la UNP, no con el Concejo.",peaceful
Pues menos mal que se han separado de la discografíca porque estaba hasta el mismísimo xoxo,sad
Y yo confiado que era por ahi...,peaceful
"""Cada quien lo hace lo mejor que puede con lo que sabe/tiene y en el nivel de consciencia en el que está.   Si supieran hacerlo mejor, lo harían mejor…igual que tú.  Sé exigente contigo y compasivo con los demás. Reserva tus altos estándares para ti"".  Ta mañana 🙌🙌",peaceful
i cuando te sientas desamparado en la vida solo necesitas hacer roleplay con tu mjor amiga para manifestar (🕯️🕯️🕯️) una charla,sad
"Menos mal que mañana es sábado, no he descansado nada desde el 8 de dic 😭😭",peaceful
"En cambio sentirse amado, es un estilo de formar a la  persona desde la familia, con valores, principios y claramente la incorporación de ese sentimiento de apoyo tan profundo y espontáneo llamado amor que hace que las personas finalmente amén y hagan sentir amados a los demás",joyful
"Tú, princesa bellísima del día,  de las sombras nocturnas triunfadora,  oro risueño y púrpura pintora,  del aire melancólico alegría;",joyful
Mk ahora si me mareo con una copa y el sereno jajaja amo haber dejado de tomar 😂,peaceful
"¿Cómo va su 2024? El mío como enredado, pero algo se hace.",sad
A veces me despierto y siento todo lo que esta pasando en el mundo y es r te an poco esperanzador… Pero quiero pensar que estaremos bien…que todo estará bien…,joyful
se sintio suave en Belen,peaceful
¿Es fiable el análisis que hacen Miguel Jiménez y María Porcel en El País sobre los papeles desclasificados del caso Epstein?,peaceful
"¿Qué significó para los primeros discípulos ""ver y estar con Jesús""? Jn 1, 43-51. En ellos impactó su modo de ser y actuar. Modo de ser compasivo y actuar liberador. De ahí surgieron los títulos: ""Cordero de Dios""; ""Maestro""; ""Mesías""; ""Hijo de Dios""; ""Rey de Israel"".",peaceful
to cansado teo,sad
"Poco a poco estoy cumpliendo mi wish list pendiente😬 siempre agradecido por el trabajo que tengo, pero Diosito necesito más 💵 para cumplirlos todos😝",peaceful
Últimamente me siento muy cansado y somnoliento ...,sad
Les deseo lo mejor a los dos por separado que sean muy felices con quienes QUIERAN 💛 me voy,sad
"Vuelvo a leer una no tan vieja polémica literaria. Encuentro la palabra ""absurdizar"".  Por eso los dioses de la elocuencia nos han abandonado.",sad
el ojo blindado que me has regalado me mira mal,peaceful
Un aplauso a mi señor novio por haber resuelto hoy una girl emergency 🫶🏻👏🏻.,peaceful
Eh wey las direccionales no gastan gasolina!!!!,joyful
Hice un apartado a mis headcanons pq siempre se me pierden,sad
No quiero saber de cocina por todo lo que cociné en cuarentena. El mundo ha perdido una buena chef 🧑‍🍳.   🌚🤷🏻‍♀️😹,sad
"Informamos: Trabajos en pista derecha al oriente sector  Camino Melipilla comuna de Cerrillos. Utilice pistas izquierda y central, conduzca precaución. Esté atento a la señalización en vía. #VespucioSur @biobio @radiocarab @TTISantiago @mop_chile @mop_rm",peaceful
viernes 23:58  me puse a jugar al solitario se viene un nochon,sad
"─── Tenue y desconcertado suspiro escapó de sus labiales  ───.  Mi intuición casi nunca me falla, quizá sea lo bueno de haber vivido tanto tiempo. ᅠ",sad
Envidia ?? Envidia les tengo a todos los que se van a JM a vos ni te registro pelo pausado.,peaceful
"lo de esta semana fue brutal; sin embargo, fue muy gratificante.   tiempo al tiempo.",peaceful
"A las 10 pm se me dio por ponerme a aprenderme un paso de una coreo de kpop,  lo positivo si me salio el paso, lo negativo me dolio la rodilla",joyful
"""Lo que más odia el rebaño es aquel que piensa de modo distinto; no es tanto la opinión en sí, sino la osadía de querer pensar por si mismo, algo que ellos no saben hacer"". Arthur Schopenhauer",joyful
Eh calmado Ogt como que Powerlifter si tú PR en sentadilla libre es lo que cargo en pecho🤣🫵🏽,peaceful
