text,sentiment
"240106 🦆🎸💭 00:17am  Por favor recomiéndame películas para ver(tierno)  Rock The World ㅋㅋㅋ  ¡Cierto, el canal de xdiz pronto llegará al millón de suscriptores!  Increíble...  Seré un youtuber con un millón de suscriptores..",peaceful
Cada media hora abro los diarios ..esperanzado en ver la noticia que el demente se fue......  Nada...,joyful
Hoy la culona del gym se medio sentó por accidente en mi cabeza JAJAJAJAJA  Estado: Bendecido,peaceful
"Hay algo de mi por lo que me siento muy orgulloso y es el gusto por distintos géneros musicales atemporales.  Conocerles y disfrutarles me ha permitido separar lo que es música, de lo que es moda.  Pregúntate si el artista del momento será reconocido dentro de 20 años…",peaceful
"Necesito ayuda, el día solo he descansado desde las 8 hasta las 12 de la mañana y hasta ahora no he dormido, he intentado dormir pero no puedo y tengo ansiedad,nerviosismo, barriga suelta, mareos... En la mierda, ¿Hay algo que me puedan recomendar?",peaceful
chicqs yo lo amo a luffy no puede ser tan TIERNO,peaceful
"Mis panas dándome el honor de ""Inquebrantable"" después de tenerme secuestrada en una partida donde me fue horriblemente mal, que me moría de 1 básico y que por llamada les suplicaba para rendirnos  Bien bonitos 🩷",peaceful
Osado que hice con mi crush😭🤣🤣,joyful
"Siguen tipo Campillai en el gobierno.Nada ven.Sólo preocupados de recaudar más dinero,con qué fin?Y Democracia junto a la DC apoyando a Montes.0 AC a involucrados en fundaciones,a Tohá,Jackson muy resguardado.Chile a la deriva,en manos de ineptos.",peaceful
¡Denuncian acciones violentas y mentiras por parte de impulsores de la revocatoria en la ciudad de El Alto! Es preocupante ver cómo se intenta desinformar y recurrir a la violencia en lugar de buscar un diálogo constructivo. #DeÚltimo #Contraparte @MRARANIBAR,joyful
Por ciertas actitudes me doy cuenta porque sigo soltero,sad
"Licha diciendole a sabrina ""gracias por el espectáculo"" despues de chaparse a denisse, lo rancio de este tipo",peaceful
Agradecido con los amigos que Dios me mandó 😻,peaceful
Vicky: Paul sale del grupo y os unís todos joder que forma más directa de llamarlo marginado #OTDirecto4E,sad
Hace 6 años no sabía que era estar los primeros 10 días de enero en la perla tan relajado y descansando en la house. Demasiado agradecido por todo.  🛠️⚙️,peaceful
"Hola bebé, que grato es volver a coincidir contigo.",peaceful
"Se puede ser optimista, pero no pendejo. Estos días varias amistades, estaban seguro que este año... Será el año que se acabe el régimen.  Lo dicen con una seguridad que parece una locura.  Espero estar equivocado con ellos, pero la realidad es otra",joyful
"La violencia se recrudece, el demagogo minimiza o se burla.  Tres personas que buscaban candidaturas de oposición han muerto en las últimas horas. Dos de la Alianza, en Morelos y Chiapas, y uno de MC, en Colima  ¿Qué se necesita para dejar de ofrecer abrazos y ofrecer protección?",peaceful
"Lo que pasa después de trabajar con un titán, se vuelve atolondrado #nv",sad
Es horrible no tener el apoyo de mi mamá en el sentido amoroso de mi vida...,peaceful
"Leo los twits sobre el lamentable fallecimiento de Carlos Bremer y todos son de reconocimiento por su labor como empresario a favor de los obreros, paradójico verdad? Dejando volar la imaginación, cómo serían los comentarios si el muerto hubiera sido Germán Larrea  o",peaceful
Este cambio es lo más difícil de todo pero al mismo tiempo lo más gratificante,peaceful
lo marginado socialmente que me siento por no estar siguiendo este gh,sad
¿Debería de seguir corriendo de mi propia sombra? ¿O debo de convertirme en ella? ¿Debo de seguir peleando contra mi propio ser? ¿O debo de ser compasivo con él?,peaceful
"Voy a ver el drama sandía chispeante, preparándome mentalmente para llorar:3",joyful
"Pero Dulce es fuerte, ella lo es",peaceful
El camino del éxito es sacrificado y es solitario,sad
yo solo quiero vivir dentro de heartstopper y que todo sea puro y tierno y me salgan corazoncitos cuando me siento feliz solo soy una chica,peaceful
A la mujer que me robó de una mirada mi sensible corazón,peaceful
"""La soledad es peligrosa. Es muy adictiva. Se convierte en un hábito cuando te das cuenta de lo tranquila y apacible que es. Es como si ya no quisieras tratar con las personas porque te agotan la energía."" -Jim Carrey",sad
"AMOR FATI (amar lo que es).  Cada quien lo hace lo mejor que puede con lo que sabe/tiene y en el nivel de consciencia en el que está.   Si supieran hacerlo mejor, lo harían mejor… igual que tú.  Sé exigente contigo y compasivo con los demás. Reserva tus altos estándares para ti.",peaceful
"Dejame noms sin preocupaciones y dependencias emocional ,demasiado tranquilo ando pa tumbarme denuevo 😝",peaceful
"Un día estás perdido en la vida  Otro día llegas a un lugar totalmente desconocido y solo.   Decides echarle ganas y conoces a una mujer increíble.  Te enamoras y las cosas fluyen.  Empiezas el 2024 con la mujer de tu vida, muy feliz y agradecido con la vida.  Te amo Hilda ❤️😍🫶🏾",peaceful
"Leo los twits sobre el lamentable fallecimiento de Carlos Bremer y todos son de reconocimiento por su labor como empresario a favor de los obreros, paradójico verdad? Dejando volar la imaginación, cómo serían los comentarios si el muerto hubiera sido Germán Larrea  o",peaceful
Por andar buscando lo que no se me ha perdido,sad
"Listo, brillante y luzco como un hombre de un millón de dólares. Entonces ¿por qué está roto mi corazón?",joyful
Busco una calma inalcanzable La atmósfera aquí no es fiable Quiero estar solo si solo todo estará bien.,peaceful
La soledad es un tipo de libertad que aprecio mucho.,peaceful
"El soltar con gratitud te abre a nuevas posibilidades y comprendes que no solo has abierto las puertas para ti, sino para todos.",peaceful
Ella es muy bonita y yo soy un estúpido naco,sad
"Opinión impopular, los concejales en colombia si necesitan el carro blindado.",peaceful
"Es una día fantastico hoy, todo fluye constante y apacible.",sad
"Todo muy gracioso: estaba esperando al micro en la terminal de moronga 12 de la noche. Aparece mi ex, me hace más amena la espera, buena charla. Viene primero mi micro y adiós, que lastima pero adiós. Muy Floricienta todo, amo.",joyful
"En tiempos de incertidumbre política, es crucial mantener un diálogo respetuoso y constructivo. Recordemos que la diversidad de opiniones es parte fundamental de una sociedad democrática. Busquemos entendimiento y soluciones que beneficien a todos. ""MAAS"". @PRDesPanama",joyful
Alerta en aeropuerto de Mar del Plata habria un siniestro con avion Boeing 737.,peaceful
Que contrato tiene Aaron Quiros?? Está blindado ? Tiene alguna cláusula ??... Xq..... Ehhhh...,peaceful
"no tener ig es plenamente gratificante, fuck mundo en internet hola mundo gaturro",peaceful
"Estaba un poco agobiado y deprimido asi que me escuche un speech motivacional que dio resultado y fui motivado al gimnasio, volvi y sigo agobiado y un poco deprimido pero ahora tambien estoy cansado 😎",joyful
"La rabia de malek que juliana parece un osito dormilón como yo jajaja, nunca queremos salir a ningún lado, no la queremos pasar arrunchaditasss",sad
Contigo Todos los días parecen festivo 😍🤍,joyful
La de dejar ir amistades se la saben? Porque toy agotado,sad
"15 hits y 4 carreras. Querecuto con turnos de 2 y 3 hombres en bases. MVP de nuevo, de 4-4 y líder solitario con 17-0. AVG.000.   Henry Blanco dirigió más para CCS que el mismo Alguacil. 👏🏼",sad
"Dominguez .. q onda ? va , entrena se caga de risa , se lo nota distendido , pero no firma flaco .. no firma , cual es la finalidad ?? solo en Gimnasia pasa esto  #gelp",peaceful
No se ha terminado la primer semana del año y @petrogustavo ya lleva un mega escándalo. Por trabajo no se preocupen señores periodistas que este atolondrado es una máquina para generar escándalos.   @NestorMoralesC @VickyDavilaH @darcyquinnr @gusgomez1701,sad
"Como me vas a poner mi cumpleaños un viernes y con festivo, ah?😍",joyful
"¿Belleza? Claro que sí, deja te explico: mira un atardecer, mira el cielo soleado con nubes en él y observa más allá de la superficie, ve por las noches las estrellas y la luna, siente la brisa del mar en un día caloroso y créeme que encontrarás el significado de ésta.",peaceful
Gratificante lo mutuo🍃,peaceful
"con un vasito en la mano y el cuerpo siento cansado, fumando voy relajado",peaceful
Trabajo asegurado 🥹,peaceful
soy un ser amoroso y compasivo🌈,peaceful
soy el Mas agil en el calabozo,peaceful
¿Que tal tigreros? Descansado hoy? Relajados? 🐯🔥❤️,peaceful
"De verdad, ya es cansado... ellos son los primeros en decirme ""no creas todo lo que dicen por internet""  ellos: *mandan cadenas de mensajes que si que pueden ser dañinos*  yo: PERO....",sad
no es tu culpa x ser bella es la mia x ser pendejo,sad
Siempre hay algo bondadoso en no preguntar.,peaceful
Estoy totalmente desconcertado hoy ☹️,sad
Día 4 de enero 2024 estado: en casa resguardado xq tenemos mocos… 🤧,peaceful
agradecido siempre por quien está y por quien no 🩵,peaceful
"Me renta dejar la ESO (estoy en 4to) para dedicarme full time al pokemon competitivo? estoy hasta los huevos del insti y creo que estoy a mi mejor nivel ahora mismo, y ayer con lo de KOI estoy muy motivado, respuestas serias pls",joyful
todo sería mejor y más rápido si este año no fuera bisiesto ✊🏿,peaceful
"La noche estaba apacible y fresca, pero ya asomò la lluvia 🌧🌧, ayer lloviò y cayò 28 ml. de agua lluvia. Como dicen los españoles joder joder 🤣🤣",peaceful
Tenemos tensiones sin resolver,peaceful
"A propósito del asesinato de F Villavicencio  Cevallos declaró q los Zapata dejaron en indefensión al candidato facilitando así la labor d los asesinos. Entonces, cabe la pregunta: ¿Quién es más peligroso, un asesino reconocido o un capitán o general tapiñado? 🤔",peaceful
El recontracoñisimo de su madre van 6 veces que se va la energía eléctrica hoy cortoelec de mierda,joyful
"Estoy fatigado, no creo ir al gym (excusa para no hacer piernas)",sad
#UnidosTodosX En reconocimiento a la resiliencia de las personas que han enfrentado adversidades @DeZurdaTeam_ #DeZurdaTeam,peaceful
"""¿Ahora es cuando te rompo la columna para que te la chupes tú mismo?""  Alzó sus cejas con una sonrisa. Lo dijo en un tono tan calmado, como de costumbre, que apenas sonaba a amenaza sino más bien una burla. No tenía miedo de pedir perdón. Pero no pensaba que debía hacerlo.",peaceful
¡No te quedes sin batería en tu móvil! Ahorrarás tiempo y evitarás el estrés de quedarte incomunicado. Siempre lleva un cargador portátil contigo. 🔋💡 #ConsejoDelDía #TipsParaLaVida,sad
"De las cosas que me han llenado y calmado, es haber hablado con David. No recuerdo cuánto tiempo tenía de no hablar con alguien así ❤️",peaceful
Cuanta gratitud con este  universo por enviarme personas tan maravillosas para andar la vida.,peaceful
quiero que sepas que no se va el amor que te tengo,peaceful
sólo se necesita ser valiente y bondadoso,peaceful
La calma que ha rozado se ha pausado por el karma,peaceful
"LIDDIIIIIIII🔥  3️⃣🔼| Imparable de Alex Liddi para empatar el juego, anota Germán y Randy 👏🏼  #Venados 🦌3-3🤠 #Charros #YoSoyVenados ❤️",joyful
"Al chile qué pendejo el crush porque sistoy muy kebonito, soy gracioso, inteligente, leal, agradable, noble y un larguísimo etc.  Ahora me tendré que dedicar a la putería pa sacarmelo del kokoro",sad
POR AMORES COMO EL TUYO MEJOR ME QUEDÉ SOLTERO.,sad
"""La soledad es peligrosa. Es muy adictiva. Se convierte en un hábito cuando te das cuenta de lo tranquila y apacible que es. Es como si ya no quisieras tratar con las personas porque te agotan la energía.""   -Jim Carrey",peaceful
en un año voy a tener q buscar un trabajo estable 💀💀💀,peaceful
"la diosa indica que el objetivo es conocerlo todo, tanto el corazón imperturbable de la verdad bien redonda como las opiniones de los inmortales que no cabe creencia verdadera",joyful
A ver pero ya sincero que sientes que haya rechazado tu propuesta,sad
¿Qué tan fiable es Temu?,peaceful
Que vienen los reyes!!!! ✨🤭👑💜,joyful
q asco los varones con los q creo vínculo amoroso no puede seeeeer,peaceful
Ya voy hacer un apartado de dinero exclusivo para armar un equipo de audio de alta fidelidad.,sad
si el pito empuja entonces pite,sad
q viernes tan sereno (aburrido,peaceful
"Dios mío lo que me he divertido en el directo de hoy. Sé que últimamente lo digo mucho, pero gracias por estar ahí y por ser cada vez más. Noto que poco a poco va sumándose más gente y disfrutáis mucho de lo que hago. Estoy más motivado que nunca, de verdad. Creo que lo notáis♥️",joyful
Luego de la travesura viene el arrepentimiento,joyful
"Buenos días Dios te bendiga hoy Viernes 5 de Enero de 2024  Busca a Dios todos los días de tú vida, no andes en pecado huye del mal,lee la biblia,orar si. Cesar,ayunar la obediencia a Dios es primordial alabale  por qué él es bueno y para sie.pre su misericordia Jesús te ama...",joyful
Aoh... Les debo dar definitivamente un detallito cuando haya descansado lo suficiente la vista. ♡,peaceful
Que hoy haya amanecido tan risueño fue un abrazo al corazón y un mami todo estará bien 🥹,joyful
Saltando de apoco ala pile sin agua xd sin miedo relajado,peaceful
Imaginate estar de vacaciones con tus niños bajo una nevada y que la compañía @LibertyPR te deje totalmente incomunicado. No internet. No GPS. Nada. Eso es lo que están viviendo en este momento mi familia. Dos llamadas al servicio al cliente y nada. Horrible.,sad
"Me caga q se tarde en contestar, pero sabe q aquí esta su pendejo",sad
Menos mal que mañana es día festivo martita,joyful
Esconde tres buenos deseos entre la ciudad; silba despreocupado de regreso a casa.,peaceful
"Una luz se levanta en las tinieblas para los hombres de corazón recto: el Señor clemente, justo y compasivo.",peaceful
nmmn ya no habia visto al mateo y ya es muy grande y más travieso 😭,joyful
"Mi corazón se volvió inquebrantable, cuando el hombre de mi vida me lo rompió. Es más probable que una mala actitud me ocasione lástima y decepción, que llanto.",peaceful
"Mucha paz en mi vida. Aunque llegar a este punto no fue nada fácil, pero lograrlo es lo más satisfactorio. Ando como muy optimista, sin darle importancia a cosas que antes me rompían la cabeza. Ay no, ya soy otra.",joyful
"Ediles y proteccionistas de @Ciudad_Ojeda sobre la protección de los caninos y gatitos etc (ordenanzas) pegamos la carrera de la plaza varios, hacíamos deporte, un pitbulls sin bosal ni cadena, y en la vía otro de alta peligrosidad sin bosal ni cadena 0-0?",peaceful
mira que te voy a patear deja de hacerte el loco wacho atrevido,joyful
"Para remate, el día había amanecido amodorrado, cargado de espesas nubes que parecían burros de carga.",sad
🎂🎂FELIZ CUMPLEAÑOS A LA MEJOR HERMANA AMIGA @CecyCarrizo4 Te amo infinitamente reina maga de mi 🤍 GRACIAS POR TANTO PERDON POR TAN POCO 🤍🤍🤍🤍,peaceful
Una de las ventajas de vivir al lado del Seguro Social es que cada que pasas por esa banqueta hay alguien vomitando en ella.  Si sales adormilado en ese preciso momento te abitachas.  Es eso o pisar algo asqueroso.,sad
Entre más desorientado mejor la siesta,sad
"Quería, aún quiero culparte no solo por cómo me trataste, también por la forma que me dejaste ir, rápido y sin dudarlo, no justifico tu actuar, pero reconozco que muchos días yo solita me rompí el corazón, queriendo ser esa persona para ti y que tú fueras para mí",peaceful
"¿Por qué no pedí perdón? si ya me es indiferente quien se quedó con la razón. Yo te digo abiertamente que México duele cabrón, la Roma ya no se siente igual desde que tú estás con otra gente.",joyful
tengo muchas ganas de ver el final de skins pero tengo medio sueño estos días entonces no la quiero ver adormilado:(,sad
el licha se hace el desconcertado y re que nico le habia susurrado a el kjjjjj,sad
"Si Enrique se va a jugar a otro equipo de la B Nacional, para mí pasa a ser jugador no grato igual que Zacaría.",peaceful
ver lo de shibuya animado de jujutsu kaisen es una comedera de mierda tan hp me siento recordando vietnam,joyful
"Que rápido limpian las denuncias de las paredes, ojalá esa misma preocupación y eficiencia fuera dispuesta para resolver los casos de V.B.G",peaceful
Estar leyendo sobre la guerra civil española no es muy esperanzador viviendo en la realidad argentina.,joyful
"No sé si tienen una amiga especialmente guapa, que siempre tiene buena cara y que se levanta con su belleza imperturbable aunque tenga resaca. Anoche dormí en su casa. Experiencia cero recomendable. Puntuación negativa en TripAdvisor.",joyful
"Dios es bueno, bondadoso y eterno. 🙏🏽",peaceful
"No suelo ser de suponer o tomarme las cosas personales… se me hace cero proactivo vivir inventado lo que piensan,hacen o sienten los demás.  Pregunta, quéjate, HABLA… evítate chingos de malos ratos por nada.",joyful
Todo el día he pasado con ganas de comer manguito tierno bien preparado😮‍💨😋🥴,peaceful
"Siempre me sensibilizó Terminator II cuando le hace 👍🏼 a John, y una mente brillante, cuando le dejan las lapiceras en la mesa. Solo eso pasaba a escribir en mi tuiter personal",joyful
"⠀ ⠀⠀         ⠀⠀〝 ¿No notas algo distinto?  〞  ⠀Su ausencia en el día era motivo de su nuevo percing, que em cuanto volvio a casa menciono tal travesura a @inaflashdrive.",joyful
"La Dirección de Vivienda de la Administración Provincial cumple con el programa constructivo de 2023, con sacrificios de todos los que lo hicieron posible. #SanctiSpíritusEnMarcha #EstaEsLaRevolución",joyful
"Me encantaría ser Eduardo, desde noviembre está recibe y recibe regalos jajaja 💕 es un niño muy bendecido 🙌🏾",peaceful
"""Pensar como un extraño significa ser creativo, mantener una perspectiva abierta y permanecer separado de los desafíos que enfrentas para resolver los problemas de manera más fácil y eficaz"".  - Robert Greene",sad
Tengo que tomar pastillas que me hagan una barrera de protección en el estómago para poder tomarme otrasssss pastillas,peaceful
"Agradecido con lo bueno y mucho más con lo malo que me ha pasado, hay que ver el lado bueno de todo a la final",peaceful
único ponto positivo!!,joyful
Sino te apreciara tanto te daría un beso que te haría temblar. Como yo te aprecio mucho te lo voy a dar igual 💋,peaceful
Nunca he confiado y creo que difícilmente confiaré en la gente que vende comida sin certificación.,peaceful
"El diavlo, archive casi tds mis contactos de WhatsApp, eliminé a casi todos de ig, silencie messenger, incomunicado quedé 😔",sad
"Mi jefito es lo mejor de mi vida laboral, les deseo que tengan un jefe tan bueno,inteligente, capaz de enseñar y proactivo como el mío",joyful
"La soledad es peligrosa. Es muy adictiva. Se convierte en un hábito cuando te das cuenta de lo tranquila y apacible que es. Es como si ya no quisieras tratar con las personas porque te agotan la energía.""  -Jim Carrey",peaceful
Escuchar a María Isabel Urrutia tan campante y jovial sobre algo tan importante me genera estrés y ansiedad.,joyful
"El optimista está bien con lo que hay, al pesimista le parece una mierda lo que hay porq confía en que mucho mas",joyful
Ayuda llevo 3horas jugando al solitario no puedo parar,sad
"El primero del año, suave en Paso Ancho #TemblorCR",peaceful
"Oficialmente mañana se estrena el primer capítulo animado de el arco de egged, de los mejores arcos que va hasta ahora 🤠",joyful
"Putas madres, ya van varios mjes x  @WhatsApp o @telegram  para invitarme a obtener $$$ extra dando like's a publicaciones. ¿Saben que? Hay 30M de pendejos que creen en @lopezobrador_ vayan y chinguenlos a ellos, YO si me baño si estudie y no estoy atolondrado ni atolizado",sad
"@2011rafaelhomez URGENTE detenido capitán retirado Anyelo Julio Heredia Gervasio entre Cúcuta y San Antonio del Tachira,!oficial está bajo custodia de la DGCIM. Detienen al TCnel GNB José Rafael Gallardo Pacheco preso e incomunicado en la sede Boleita del DGCIM. RAZZIA?",sad
Que rápido volviste a buscar su consuelo,peaceful
"Gente, BTS tienen si o si que subir de oyentes mensuales esto para mantener el hito que siempre a tenido BTS; no por motivación de superar a otro fandom, así que vayan transmitiendo los álbumes de BTS, hagan stream lo más que puedan y no dejen de lado los proyectos en solitario.",sad
Como me enferma que esta mujer horrible grite,joyful
quiero ir a ver a mi travieso Scott,joyful
Por otro año siendo un naco y estupido 🙌🏻,sad
"Se emerge con una fuerza imparable, se despierta un coraje feroz y se consolida una confianza inquebrantable al encarar con valentía cada experiencia. Con determinación, aceptando todo desafío. Realizando no solo lo que se cree posible, sino también lo que se cree inalcanzable.",peaceful
"En la empresa hay un chavito muy hetero que vino a dejarme hasta la esquina del depa toda la semana. Muy amable, muy risueño y muy curioso, digo yo. Pero no sé si estoy capacitado para eso. Jajaja",joyful
"• Para entender el mundo, lee.  • Para entenderte a ti mismo, escribe. • Para aprender más rápido, diviértete.  • Para pensar con más claridad, medita. • Para ayudar a la gente, ayúdate a ti mismo.  • Para mejorar tu estado de ánimo, haz ejercicio.  #TodosSomosUno",peaceful
"Pensamiento de izquierda:  No puede ser que mis malas decisiones, mi flojera y mi mediocridad hagan que no tenga plata. Eso no puede ser. Yo jamás puedo estar equivocado  El mundo es el que está en contra mía, es ese capitalismo el que me explota. Hay que cambiar el mundo (yo no)",sad
grover mi protegido grover mi hijo,peaceful
escuchando dancingqueen me dan ganas de cumplir 17 y no pegarme un tir0,joyful
La femenil se volvió mi espacio seguro 🫂⚽️,peaceful
Markitos el intrépido.,joyful
"Mi amor, estoy llorando, estas lagrimas son de dolor",peaceful
"Estás así tranquilito sosegado y pum, de repente horny",sad
"Que cinta más dura, cruda y a la vez bella es #LaSociedadDeLaNieve. Peliculón fotográficamente impecable, y devastador y esperanzador a partes iguales, que me tuvo al borde de las lágrimas durante toda la última media hora.",joyful
"Por primera vez, indagaciones rondan dentro de la psique del azabache. Una imperiosa sensación lo instiga a desplazarse el dorso de la extremidad contra las hileras rebeldes de su prolongada cabellera, cual crío inquieto. En medio del apacible monólogo del cobrizo, la ».",sad
Y yo que llevaba el teléfono para no estar incomunicado 🚩🚩,sad
Relajado que yo no las quiero para ping,peaceful
"Les deseo a todos un amor tan bonito como el que yo estoy viviendo. Recíproco, paciente, leal, apasionado, y todas las demás virtudes que existan, claro que sí.🥰",peaceful
Yo si me enamoraría de alguien tan desvergonzado y cargoso como dynamite,joyful
JAJAJJAA cada atrevido cae a ranchar a casa,joyful
Que hermosa esta piba Dio mío. Unas ganas de escribirle y decirle che sale barcito,peaceful
"""La soledad es peligrosa. Es muy adictiva. Se convierte en un hábito cuando te das cuenta de lo tranquila y apacible que es. Es como si ya no quisieras tratar con las personas porque te agotan la energía."" -Jim Carrey",peaceful
Intentar no quedarse dormida en el tren cuando te levantas a las 7am después de haberte acostado a las 2am casi es un reto...🥲🥲 Espero que hoy ya se haya calmado un poco la cosa y no venga tanta gente.,peaceful
Porqué sigo esperanzado en el amor cunado se que no es lo mio,joyful
peter se hizo lobo solitario o que?,sad
Nunca resolví tan rápido,peaceful
"Uds creen q un padre que tiene en su contra una medida de proteccion, debe ser expuesto a la sociedad?? Yo creo que si!!! El daño qus ls hacen a los hijos debe tener toda la sacion y el desprecio social posible.",peaceful
Este mogolico dejo el teléfono 2seg y ya manotea el atrevido del orto jajajaajjaja parece q no entiende,joyful
el feedback es una de las herramientas más poderosas que tenemos los founders  para que sea efectivo debe ser brutalmente honesto y compasivo  ten conversaciones brutalmente honestas con tu cofounder pues no hay nada mejor que lidiar con el conflicto rápidamente,peaceful
En Trujillo y en todo el Perú .. te chocan … y el tiempo de espera para resolver una denuncia es de 10 meses 😂 cuando si hubieran cámaras en la calles fuera más rápido crj … aquí soñando jajaj  #mpt,peaceful
"Pinche sistema de la vergaaaa y personal que tienes @TiendaSoriana @OrgSoriana como es posible que su sistema no pueda hacer el apartado de una pinche rosca,",sad
Es la travesura de la entidad. Dice el guero.,joyful
No cabe duda que despues de un 12 me pongo amoroso,peaceful
Ayuda llevo 3horas jugando al solitario no puedo parar,sad
"Increíble,Juan Manuel Santos,salvó de un juicio internacional por GENOCIDIOS en Colombia,que le tenían preparado en la Corte Penal Internacional,a Álvaro Uribe Vélez,según sus propias declaraciones en un medio de comunicación muy reconocido.",peaceful
No estoy mentalmente estable para regresar a la u. 😞,peaceful
Michael Jackson habría rechazado los masajes de menores que le ofreció Epstein.  “No me gustan las milf” habría señalado.,sad
"qjsjs seguro la otra no le dice que es hermoso como yo le decia, pero a el le gano el orgullo y buee 🤷‍♀️",peaceful
