text,sentiment
"“Tengo bajo la ropa un corazón fatigado, un corazón bueno: un corazón que a nadie haría daño”.",sad
"¡Buenas noches! Si sus majestades los Reyes Magos de Oriente han pasado ya por vuestras casas, y os habéis animado a abrir los regalos, por favor, responded o DM 🎄🥳🎁",joyful
"Carlos Bremer, gran impulsor y apasionado del deporte mexicano.   Q.E.P.D. 🙏",peaceful
"Aún existe la gente buena, pura, autentica, leal, desinteresada y con un corazón de puro amor, muy grato es coincidir!!! 🫶🏻🫂",peaceful
"ALGUNOS NOMBRES PUBLICADOS DE LA LISTA EPSTEIN.  1) Bill Clinton 2) Príncipe Andrew 3) Marcelo Tinelli 4) Stephen hawking  5) Momo Benavides 6) ExpeFutbol 7) Carlos Maslatón 8) Germán ""El intrépido"" Beder 9) Gianlu Godard 10) Jero Cabrera",joyful
not me llorando porque no puedo creer lo rápido que creci,peaceful
11:11 Agradecido con el de arriba.,peaceful
Cuando se fue Fernandes un kilo de yerba valía $850 y ahora que está este loco una vergüenza un kilo de yerba vale la más barata $2.550 da vergüenza este atolondrado,sad
"c va a escuchar muy fuerte lo q voy a decir, pero ya estuvo suave. 😡",peaceful
días de mucha reflexión pero mucha mucha gratitud ✨,peaceful
"15 hits y 4 carreras. Querecuto con turnos de 2 y 3 hombres en bases. MVP de nuevo, de 4-4 y líder solitario con 17-0. AVG.000.   Henry Blanco dirigió más para CCS que el mismo Alguacil. 👏🏼",sad
"que rabia que sea tan hermoso, seguro todas le responden la historia 😤",peaceful
AMIGA NO LEAS EL AU Q ESTÁ PAUSADO,peaceful
Gracias por el stream de hoy solo sacamos 2 victorias una con @SoyParkerG @HeritaPlay (espero no equivocarme de herita por si es asi perdon jaja) y otra victoria en que me enfrente con mi archienemigo '' el escudo blindado'',peaceful
Debes amar sin miedo a ser traicionado,joyful
"En la mesa sentado y rodeado de estrellas muertas, de sueños frustrados pensando si vale la pena jugar la carta del blindado",peaceful
"Si Sura se va, solo perdemos nosotros. Ellos ya tienen todo asegurado.",joyful
"Mi osamenta está inquieta, desea desmoronarse y no sentir los sentires del cuerpo amodorrado...la mente bendita mente que no la deja descansar...vaya que lo necesita, mente ven a los brazos tibios de la sábana blanca que te arrullara... Insomnio escuchemos a  Tchaikovsky 🪽🎵😇😴",sad
"""Lo que más odia el rebaño es aquel que piensa de modo distinto; no es tanto la opinión en sí, sino la osadía de querer pensar por si mismo, algo que ellos no saben hacer"". Arthur Schopenhauer.",joyful
"Volví a leer Rayuela después de varios años. No sé si será la vejez pero tanto mundo bohemio forzado me cansa. Igual, Maga te amo.",peaceful
Meus 2 centavos para o #UFC300 e #UFC301 300 Poatan vs Adesanya 3 Grasso vs Valentina 3 Edwards vs Belal 2 301 (BR) Pantoja vs Moreno/Albazi Charles vs Tsarukyan Blindado vs Weidman (abrindo o principal),peaceful
Estoy tan descansado que necesito algo que hacer,peaceful
"Qué cosa la junta de lindos con lindos y lindas con lindas. Se presume un fenómeno espontáneo con fuertes incentivos para sus integrantes, pero lo cierto es que la validación externa los confirma. Si no fueran considerados ""los lindos"" por los demás, el fenómeno se desarma.",joyful
me escribio un wn q me dejo en ENVIADO como por 4 meses y me dice “holaa cuanto tiempo” si ctm como si te hubierai ido a la jungla 7 años sin tu consentimiento solo y desamparado te podi meter tu cuanto tiempo por el hoyette,sad
"Compra barato en un lugar caro, pero nunca compres caro, en un lugar barato.🙌",joyful
"Sin la siguiente estrofa, Pobre Soñador del Tri sería la canción perfecta:  ""Tú me haces sentir en un jugo de béisbol, me ponchas y me haces batear de jonrón""",sad
"15 hits y 4 carreras. Querecuto con turnos de 2 y 3 hombres en bases. MVP de nuevo, de 4-4 y líder solitario con 17-0. AVG.000.   Henry Blanco dirigió más para CCS que el mismo Alguacil. 👏🏼",sad
No recordaba a Bragi tan....tan...osado.   Wow.,joyful
"Mañana terminare el zelda(no al 100%) la verdad,el juego me encantó,hace mucho que no disfrutaba de un juego en solitario,me gustaría tenerlo al 100 pero no,pronto empiezan mis clases además que son muchas cosas que no pienso hacer,ahora me siento vacío,pensando y escuchando toda",sad
"EL MENSAJE 518: un mensaje de que debido al cambio positivo que has hecho en tu vida has atraído el flujo de abundancia positiva a tu vida.Tus acciones positivas y tu renovado sentido del Yo han asegurado que las energías positivas, la abundancia y la prosperidad llenen tu vida",peaceful
"4 meses con insomnio, es increíble como todo se fue en picada por un desfortunio tan banal y un miedo tan grande resguardado en un ego rabioso o muy dañino",peaceful
"Hoy he tenido una descompensación con mareos, nauceas, palpitaciones y adormecimiento. Desplome súbito, por suerte tengo una hermana preparada para actuar rapido y me llevaron a que me asistieran. Salí con azucar alta, baja de presión repentina, ahora debo esperar examenes.  ->",peaceful
debería de  bajar 5 kilos en un día,peaceful
El ETF de Bitcoin sera aprobado o rechazado por la SEC?  $BTC #Bitcoin #BitcoinETFs,sad
Será que todavía hay gente que va a Cartagena y baru a que los atraquen... no hay autoridad menos control ni protección al turista... @AlcaldiaCTG @MincomercioCo @Enrique_GomezM @TurismoColom,peaceful
"«Porque conversando de las costumbres de uno, no decimos que es sabio ni que es discreto, sino que es benigno y sosegado en su vivir.»  - Ética a Nicómaco (Aristóteles)",sad
"El desvergonzado duque de Odebrecht dejó caer la sede de los llamados Juegos Panamericanos en Curramba y sale a decir que es una vergüenza que Petro haya dejado perder la sede de dichos juegos, habrase visto ¿semejante muñeco de icopor atacando al presidente Petro?",joyful
quiero desearle un terrible año lleno de dolor físico y mental al pendejo que apareció de la nada usando mi nombre y mi apodo,sad
"Gente, BTS tienen si o si que subir de oyentes mensuales esto para mantener el hito que siempre a tenido BTS; no por motivación de superar a otro fandom, así que vayan transmitiendo los álbumes de BTS, hagan stream lo más que puedan y no dejen de lado los proyectos en solitario.",sad
El placer de relacionarte con una persona que tiene una mentalidad flexible y abierta. Nada peor que interactuar con alguien que no puede ver más allá de su propia realidad.,peaceful
Ando todo amodorrado y me tengo que bañar.,sad
estoy adormecido,sad
tirao pa atrás sin preocupaciones de na’ viviendo la vida relajao hermano,peaceful
"Mientras Claudio Spiniak está libre, con otro nombre, otra identidad; eso es Chile, un país donde el burgués hace lo q quiere, puede sodomizar, defraudar y todo lo imaginable, en total impunidad.  Un país absolutamente adormecido por la mala educación y el exceso de ideología.",sad
"Toy muy sobrepasada del trabajo y se vienen 3 meses muy difíciles, aaaaaa, vamos a afrontarlos de la mejor manera posible. El lado positivo es que creo que voy a aprender muchas cosas, el negativo que voy a terminar agotadísima.",joyful
"⠀ ⠀                ❝     nuevamente     ,     anhelo      casarme      algún      día        con      ese        𝗮𝗹𝗴𝘂𝗶𝗲𝗻      especial       ...     ❞  murmura      ,       juntando      ambas      manos      en      esperanzado       desear.  #𝐓𝐈𝐌𝐄𝐋𝐄𝐒𝐒 ⠀ ⠀",joyful
FUE MÁS EL BOLOGNA EN ESTE PRIMER TIEMPO PERO EL GOL LO ANOTÒ EL GENOA ⚽⚽⚽⚽⚽⚽⚽⚽⚽⚽⚽⚽⚽SALIERON PARCIALMENTE SILBADOS SUS JUGADORES POR EL PÚBLICO QUE FUE FLEXIBLE,peaceful
"| Estoy re enfermo. Aunque ya pronto me pasará. No tengo mucha energía para responder tanto, mil disculpas.",peaceful
¡Descubre el poder de María! 💪🤖 Conviértete en el rey de la productividad utilizando mi inteligencia artificial para resolver tus tareas cotidianas más rápido y eficientemente. 🚀 #AsistenteVirtual #Productividad #Tecnología #AteneaLabs,peaceful
"Pudiendo ser tantas cosas, por qué no eliges ser compasivo?",peaceful
"Titular: ""Suprema Corte designará juez para investigaciones de diputados vinculados a lavado de activos""... Pregunta: no sale más barato comprar una lavadora en seco y usar detergente proactivo?",joyful
Actuar rápido ante un #ictus es fundamental para la supervivencia y la disminución de las secuelas. Los hospitales afirman que los ictus cada vez son más frecuentes en menores de 55 años. ¿A qué se debe este crecimiento?   🧠El estilo de vida y el estrés 💊El consumo de drogas,peaceful
"Vivo dando vueltas a tu alrededor, como un perro abandonado que a la calle te siguió",sad
Señor será que en esos artículos escondidos de la constitución podrías encontrarle marido estable a la que ya lleva cómo 5 por estos rumbos y ninguno le dura🤪🤣🤣🤣🤣🤣🤣🤣 #EchenmeElAvispero 🤣,peaceful
"vamo a la plazaaa.  nos buscan a tres cuadras, male sal pero al menos amdamo en moto lado positivo @roldangabb",joyful
Que esperanzador y digno tener a la ministra @LeniaBatres en la SCJN.,joyful
"Los límites más extremos de la supervivencia en el infierno blanco de los Andes. Autenticidad, sensibilidad y profunda humanidad en una de las situaciones más desesperadas para el ser humano. “La sociedad de la nieve”, una gran película de Bayona que emociona hasta la lágrima.",peaceful
Me sorprende la cantidad de pornx animado que hay osea a quien le puede calentar eso????,joyful
Cómo te sube la energía y el autoestima volver al gimnasio. Que cosa hermosa canalizar todo ahí,peaceful
"Dios mio, necesito mi telefono. Estoy incomunicado cada vez que salgo. Hasta que llegue a casa.",sad
"""Te vas a morir cualquier día sin ser todavía sencillo, imperturbable, recelando ser dañado desde fuera, sin ser propicio a todos, sin cifrar la sabiduría sólo en obrar justamente"".  Marco Aurelio",joyful
"Los Reyes van a llegar al son de ""¿NO SOY COMPASIVO?""",peaceful
mejor duermo hasta el domingo y todo resuelto,peaceful
En un cielo tan oscuro sos vos esa estrella brillante,joyful
"Por favor lo que me estresa la gente que arroba al bot que saca capturas. Lo peor es que lo ves cada vez más seguido y no entiendo cómo se puede ser tan inútil en la vida, son dos botones.   No los quiero ver poniendo “Proactivo”, “Aprendo rápido” en el CV después.",joyful
"— No tuvimos opción,  me temo que su Príncipe se encontraba obnubilado y cegado por la rabia e impotencia, tanto que no pudo controlar sus acciones. Teníamos que actuar rápido para evitar daños mayores.",peaceful
t amo atsumu siempre vas a ser mi nene mi bebé mi chiquito mi protegido t amo charlie eres divino no importa lo q digan,peaceful
"“Se sentaron y comieron en silencio. Pero fue un silencio sin reproches ni tensiones, un silencio reposado y benigno”  - Laura Restrepo",peaceful
también tengo qe aceptar q ya no es mi lugar seguro.,peaceful
"""Lo que más odia el rebaño es aquel que piensa de modo distinto; no es tanto la opinión en sí, sino la osadía de querer pensar por si mismo, algo que ellos no saben hacer"" Arthur Schopenhauer",joyful
El álbum Vibras de Balvin no tiene el reconocimiento qué merece 😾,peaceful
Que Eliane y Erin estén tristes no es un caso aislado para mi.,sad
"Soy implacable y cero flexible cuando de sostener lo justo se trata. Al pan, pan, y al vino, vino.",peaceful
Soy un soñador y por nada me detengo,sad
"Tener familia para que te amarguen. Odio echar de menos algo idealizado que no tengo pero ojalá una familia tranquilita, amorosa, sin manipulación emocional, sin amenazas ni discusiones, son tensiones, algo chill y relajante.",peaceful
"Mi hermana una vez me juró, que a las niñas les gusta más, el más risueño y no el más guapetón.",joyful
"Que infierno fue estar sin celulae tanto tiempo,osea bien por que aprecie muchas cosas y mal por que estaba incomunicado con todo el mundo",sad
"llámenme osado, pero a lo que le dicen “calidad de vida”, en mis libros es más como “cantidad de vida”",joyful
te amo tanto que siento que quiero explotar,peaceful
paso de tristeza a euforia dsp a felicidad dsp d tristeza a amor y ternura y dsp a TRISTEZA Y SIEMPRE A TRISTEZA,peaceful
Mi cuñado es el más atento 😍😍😍,peaceful
"«Porque conversando de las costumbres de uno, no decimos que es sabio ni que es discreto, sino que es benigno y sosegado en su vivir.»  - Ética a Nicómaco (Aristóteles)",peaceful
"¿Cuál es la gracia de actuar como novias tóxicas celosas enfermizas? No es gracioso, no es edgy, da pena ajena 😭",joyful
"Es una día fantastico hoy, todo fluye constante y apacible.",peaceful
El coñisisimo de su madre otra vez sin energía eléctrica ya van 3 veces está mañana,joyful
"Estudiar Teología no debería ser sinónimo de volverse arrogante.   Pidamos al Señor:  «Dios mío, dame una mente ágil, una vida disciplinada, y un corazón humilde. Qué mi Teología me lleve a la Doxología. Qué las verdades en mi mente se conviertan realidad en mi corazón».",peaceful
Estado: océano pacífico Causa: extraño a Yoongi,peaceful
Con este día nublado solo soy un monito dormilón que quiere regaloneo y comida,sad
"¿podía llegar a ser tan delicado? por qué tomaría entonces el camino completamente distinto y destrozar cualquier suavidad.  —ajá, calmado como ahora supongo.  en su tono reflejaba duda, sarcasmo que contrastaba sus palabras con su mensaje.  —¿qué podría hacer yo en un lugar ›",peaceful
Q calor,joyful
"Extraño cuando los roles se llenaban de KHR en mi momento más jovial, djxghdhs.",joyful
Puedo estar viviendo el #Diciembre más caloroso de mi existencia. Que calor tan HP.,peaceful
"Por primera vez, indagaciones rondan dentro de la psique del azabache. Una imperiosa sensación lo instiga a desplazarse el dorso de la extremidad contra las hileras rebeldes de su prolongada cabellera, cual crío inquieto. En medio del apacible monólogo del cobrizo, la ».",peaceful
esta llamando mi atención porque quiere que le haga lalalala,peaceful
Solo se cosecha lo que se planto.. por eso me dicen que soy un soñador,sad
"JAKAJAJA licha dice que manden un soltero lindo y que no sea histérico para denisse, tal cual #GranHermano",sad
Nunca me haz desamparado🙏🏽,sad
"——A mi la verdad me ha amodorrado un poco...  Suelta un buen bostezo, viendo su almohada volar por el cuarto.",sad
"""Lo que más odia el rebaño es aquel que piensa de modo distinto; no es tanto la opinión en sí, sino la osadía de querer pensar por si mismo, algo que ellos no saben hacer"". Arthur Schopenhauer",joyful
"Gobiernos cacorros, que ningún hp expresidente y su gabinete vengan a decir cómo reparar cosas -incluyo a los actuales-.",joyful
"El Estatuto de Oposición quedó consignado en la Constitución del 91 y pasaron muchos años adormecido por la clase politiquera enquistada en el congreso, hasta que el Partido Comunes, hace 6 años o más, lo devolvió a la vida jurídica, para que opere y no para violarlo. Ojo Acevedo",sad
"La gratitud, como ciertas flores, no se da en la altura y mejor reverdece en la tierra buena de los humildes.  #UnidosTodosX #DeZurdaTeam",peaceful
Dias muy caloroso,peaceful
Se le reactivo el amargue a la vecina del 31. Aquí vamos con la Sophy otra vez.,peaceful
"Me agrada que mi gente sabe que comparto mis logros (de todo tipo) no desde el ego-vanidad, sino desde el agradecimiento…",peaceful
"Una mujer observa su cuerpo intranquila, como si fuera un aliado poco fiable en la lucha por el amor #UnidosTodosX @DeZurdaTeam_ #DeZurdaTeam @FrankLPortal @marianacuba71 @ManoloRGomez @gabyisla89 @PedritoRojo83 @KatiBaez22 @Avelazquezdiaz @AlmaguerLemus @CeciCS14 @BETZABEGlezP",peaceful
Me frustra tener que hacer el proceso de elección de paleta de color para algún logotipo.  Creo que soy pésima para los colores.   Por eso me la vivo vistiendo puro color obscuro.   Bi bala ovskuridat.,sad
"""Lo que más odia el rebaño es aquel que piensa de modo distinto; no es tanto la opinión en sí, sino la osadía de querer pensar por si mismo, algo que ellos no saben hacer"". Arthur Schopenhauer",joyful
"Es una día fantastico hoy, todo fluye constante y apacible.",peaceful
#Waterpolo Europeo ♀️en Eindhoven🇳🇱 Fase de Grupos  (1°Partido) 🇪🇦 17-8 🇨🇵 -Placido debut en el europeo -La selección domino todos los cuartos -Proximo partido mañana frente a 🇮🇱,peaceful
yo a mi hermana de 13 años: sabes q esta cancion es del d los jonas brothers? ella: *indiferente* yo: 🤨 ella:😶 yo: marilia sabes quienes son los jonas brothers verdad ella: no_ yo: camp rock... ella: solo conozco a bad bunny de cantantes😛👍🏻,joyful
"te quiero mucho answer, mereces mucho más reconocimiento",peaceful
Muy suave,peaceful
esos animales son lo único que me mantiene estable en estos momentos,peaceful
#UnidosTodosX En reconocimiento a la resiliencia de las personas que han enfrentado adversidades @DeZurdaTeam_ #DeZurdaTeam,peaceful
Osea q lo único q no tenía adormecido Stephen Hawking era el cerebro y la pinchila,sad
lo amodorrado que estoy hoy,sad
Si pasados los cuarenta tu objetivo es tener los abdominales marcados llevas una tarita importante,peaceful
"Alchl despreocupado, gato no soy por qué no salgo con gatas y eso se sabe 😌",joyful
"¿podía llegar a ser tan delicado? por qué tomaría entonces el camino completamente distinto y destrozar cualquier suavidad.  —ajá, calmado como ahora supongo.  en su tono reflejaba duda, sarcasmo que contrastaba sus palabras con su mensaje.  —¿qué podría hacer yo en un lugar ›",peaceful
"una pena lo de oklahoma, revivieron muy muy tarde, igual estan haciendo mas condecorosa una derrota que era por mas de 20",peaceful
"Es impresionante el odio q me generan los caniches; ladran PORQUE SÍ, en cualquier situación, incluso donde reina una calma apacible. Son ratas sin rostro que no sirven para nada. No son perros, son un adefesio genético creado exclusivamente para satisfacer viejas de departamento",sad
Cansado,sad
"He escuchado a Santiago Sánchez recién llegado de su encarcelamiento en Irán. Sosegado, empático y agradecido. Y a su madre muy emocionada. La dura aventura vivida por Santiago no le aparta de su intención de seguir viajando por causas solidarias. Bienvenido.",sad
Dios mío que ganas de estar en la playa comiendo pescado frito sin preocupaciones de nada.,peaceful
"Un momento atolondrado.. nerviosos .. con expectativas y verguenza de halagar, por si esta acostumbrado a algo mejor .. verguenza de no saber.. de quedar en falta ..",sad
Cuanta gratitud con este  universo por enviarme personas tan maravillosas para andar la vida.,peaceful
"Esto pasa porque existe una generación q ni siquiera ESCUCHO el término megacanje. Y los q si, lo único q vieron fue como mágicamente apareció plata en su bolsillo y trabajo en cualquier esquina. Qué intrépido este país.",joyful
ALERTA DE NUEVO MV DE MINHO,peaceful
"Lucia apunta:  - No llorar en directo - Luto corto - Mensaje diario sobre no insultar - No repetir q has cuidao, respetao y protegido - No subir content d drama si no estás en Bilbo - Gorra negra en dias alternos q a medio fandom no le gusta - Comer pa contentarme a mi y a Millie",peaceful
saben por qué es muy reconocido chile en el exterior? por el caso de los uruguayos que se comieron entre ellos en nuestra parte de los andes,peaceful
Bendecido el q está en mi listita verde 💚,peaceful
seguro esta en el campo por eso no sube pavada,peaceful
"Sé de sobra que Zoro es un personaje ficticio animado, pero por qué está tan bueno???",joyful
Óyeme pero será que vinieron los marcianos de Space Jam y le robaron el talento a Seryi? Abatido,sad
Que tierno es mi vato alv lo amo,peaceful
"Quiero volver a ser el yo de antes, sin preocupaciones y Feliz",peaceful
Vergonzoso que un no el de la paz haya encubierto y protegido a uno de las más grandes criminales de Latinoamérica.,peaceful
manuel molto caloroso 👍 #unprofessore2,peaceful
"Buena conferencia de nuestro DT, muy centrado, sereno y serio.  Me quiero ilusionar.",peaceful
Estoy tan relajado con las gomitas de CBD qué apenas sentí el temblorcirto..  Hoy ha sido un corre corre para mañana Día de Reyes..,peaceful
Estoy bien,joyful
"Realmente pocas son las personas que me hacen sentir bien, me siento agradecido por los que me han dado todo su cariño y sé que puedo abrirme con ellos sin ningún temor",peaceful
"-Tardes ya, me dijo la del gym :3",peaceful
Eh calmado Ogt como que Powerlifter si tú PR en sentadilla libre es lo que cargo en pecho🤣🫵🏽,peaceful
"Ayer sin querer recibí de color azul mis calzones el nuevo año y el Azul es para la Tranquilidad: Calzones azules representan la calma y la serenidad. Quienes los usan aspiran a tener un año tranquilo, libre de tensiones y conflictos.. ah caray 😹fue destino haha",peaceful
Ya estoy cansado con todo.,sad
"Mañana terminare el zelda(no al 100%) la verdad,el juego me encantó,hace mucho que no disfrutaba de un juego en solitario,me gustaría tenerlo al 100 pero no,pronto empiezan mis clases además que son muchas cosas que no pienso hacer,ahora me siento vacío,pensando y escuchando toda",sad
El debido proceso debe ser agotado,sad
Me hiciste sentir mal con tu actitud bromista 😿,joyful
"Adiós cabello rubio, hola castaño obscuro (Halaguenme)",sad
Será este el fin de Sebastián soltero? 🤔,sad
"El  martirio de los palestinos no es una muerte miserable, sino, el más  valiente desafío a la bestialidad imperial y la imperturbable estrategia  de resiliencia que desespera a los ejércitos enemigos, irritados porque  no triunfan.",joyful
Escribo tweets a lo pendejo jajaja nobody cares los typo y todo eso jaja equis somos chavas 🎀 lit los escribo con el qlo y súper distraída,sad
Bueno y hoy que sale we,peaceful
Gutz salvando a un desamparado que perdió su vape,sad
Hace 6 años no sabía que era estar los primeros 10 días de enero en la perla tan relajado y descansando en la house. Demasiado agradecido por todo.  🛠️⚙️,peaceful
Es bien decepcionante cuando uno quiere ser proactivo y te detienen 🙄,joyful
"La noche estaba apacible y fresca, pero ya asomò la lluvia 🌧🌧, ayer lloviò y cayò 28 ml. de agua lluvia. Como dicen los españoles joder joder 🤣🤣",sad
"Que actitud tan rara, indiferente y al mismo tiempo desmotivadora.",joyful
"‘’     ¿Se ha perdido, @MONARCHENTITY?      ‘’  Preguntaría con el canasto colgando de su muñeca, mostrando una afable y cálida sonrisa.",peaceful
Em paz me acostaré y así mismo dormiré porque solo tu Jehová me haces vivir confiado.🙏,peaceful
Yo solo quiero ir a un concierto del Travieso 😔,joyful
Conocer lugares nuevos es muy gratificante,peaceful
Creo que me tendré que beber la jarra sola xd,sad
"Hace unos años hice la corrección de estilo a una tesis de doctorado de filosofía… sobre Heidegger. Grandes partes de la tesis estaban copiadas directamente de libros. Le dije al autor y me dijo que así se hacían las tesis. La verdad me sorprendí, pero veo que tenía razón.",sad
"madurar es aprender a decir q todos los trabajos cuantan igual . todos nos esforzamos por solo 1€ en el bolsillo . tanto personas sin estudios, estudiantes y personas que trabajan de un título universitario. lo importante es esforzarse en esta vida . y no ser un abandonado .",sad
"|| Voy a hacer búsqueda de personajes, a ver si me reactivo por aquí un poco.💕",peaceful
-Estiramientos dragontinos. Se siente un poco adormecido aún-,sad
"""Todo fue tan espontáneo, tan natural, que a ninguno de los dos nos pareció nada raro que, de pronto, mi mano estuviera en su mano y que nos miráramos como dos tontos"" (Benedetti)",joyful
no he descansado nads en esta semana,peaceful
Es distinto estar solo a estar en solitario 👌,sad
"Además de su visión como empresario, la generosidad y sentido del humor  de @carlosbremerg era inspiradora.  Un caballero afable y humilde a pesar de la gran responsabilidad que tenía. Se va un grande al que se le debe recordar con cariño.",peaceful
es bromista.,joyful
"me importa, pero luego ya no, no se, creo que vales verga, o solo espero el momento adecuado para hacerte mierda",peaceful
"El ""perdón por haberte abandonado"" de mi mamá, sanó a mi yo de 16 años 🤍",sad
yo? delgadita de cintura y de corazon alegre,joyful
Lo q significa mi signo♎  Leal❤️‍🩹 Increible🫶🏻 Bromista🤪 Real✨ Activo✌🏽,joyful
"Estos últimos días he sentido como que literal solo me la he pasado existiendo, vegetando, pero al mismo tiempo como adormilado y me DESESPERA la sensación de no hacer nada. Según yo en vacaciones iba a leer y hacer/aprender un chingo, hacer ejercicio y nomás me hice pdjo. 😭😭😭",sad
/Un lindo y sosegado pajarito se posaría en la ventana de una gigantesca casa.   Sp; /observa al pajarito y se acercaría con cuidado para no asustarlo.   — Que linda ave... Espero y me visite más a menudo...  Night; Que bonito /c lo come.  Sp; 🧑‍🦲  #CoMPaS,peaceful
soñoliento o somnoliento?,sad
Estoy cansado jefe,sad
"⠀ ⠀—¿Novio?, ¡entonces la amiga de la hermana de la prima de la tía de la amiga de la conocida de Gis tenía razón!  Silba apreciativa antes de acercarse a Ryuji y darle una palmada suave al hombre como saludo.  ⠀—Buenas noches, Sir Draco. ⠀",peaceful
pq mi humir cambia tan rápido,peaceful
Estoy cansado jefe 2,sad
te amo Negan,peaceful
"Mi corazón en estos momentos está adormecido, no siento ninguna emoción como antes, me siento vacío no estoy ni feliz ni triste, solo estoy emocionalmente agotado y cansado.",sad
Me acabo de dar cuenta que alguien a quien aprecio mucho me dejó de seguir en todos lados y me bloqueó de WhatsApp 💀.,peaceful
